results/tvm_log/mobilev2-fpn-quant-nx.log
{"input": ["cuda -keys=cuda,gpu -max_num_threads=1024 -model=tx2 -thread_warp_size=32", "conv2d_NCHWc_int8.cuda", [["TENSOR", [1, 1024, 16, 16], "int8"], ["TENSOR", [76, 1024, 1, 1], "int8"], [1, 1], [0, 0, 0, 0], [1, 1], "NCHW", "int32"], {}], "config": {"index": 232122, "code_hash": null, "entity": [["tile_n", "sp", [-1, 1, 1, 1]], ["tile_f", "sp", [-1, 1, 19, 1]], ["tile_y", "sp", [-1, 1, 1, 1]], ["tile_x", "sp", [-1, 2, 8, 1]], ["fuse_yx", "ot", 1], ["tile_rc", "sp", [-1, 32]], ["tile_ry", "sp", [-1, 1]], ["tile_rx", "sp", [-1, 1]], ["reorder_inner", "re", [1, 0, 2]], ["AA_double_buffer", "ot", 0], ["WW_double_buffer", "ot", 0], ["auto_unroll_max_step", "ot", 0]]}, "result": [[3.156181169324222e-05], 0, 4.9535071849823, 1615380747.2922251], "version": 0.2, "tvm_version": "0.8.dev0"}
{"input": ["cuda -keys=cuda,gpu -max_num_threads=1024 -model=tx2 -thread_warp_size=32", "conv2d_NCHWc_int8.cuda", [["TENSOR", [1, 512, 32, 32], "int8"], ["TENSOR", [76, 512, 1, 1], "int8"], [1, 1], [0, 0, 0, 0], [1, 1], "NCHW", "int32"], {}], "config": {"index": 14153890, "code_hash": null, "entity": [["tile_n", "sp", [-1, 1, 1, 1]], ["tile_f", "sp", [-1, 1, 19, 1]], ["tile_y", "sp", [-1, 1, 1, 1]], ["tile_x", "sp", [-1, 2, 16, 1]], ["fuse_yx", "ot", 0], ["tile_rc", "sp", [-1, 16]], ["tile_ry", "sp", [-1, 1]], ["tile_rx", "sp", [-1, 1]], ["reorder_inner", "re", [2, 0, 1]], ["AA_double_buffer", "ot", 1], ["WW_double_buffer", "ot", 1], ["auto_unroll_max_step", "ot", 1500]]}, "result": [[4.578321624087591e-05], 0, 27.66425395011902, 1615385734.5328069], "version": 0.2, "tvm_version": "0.8.dev0"}
{"input": ["cuda -keys=cuda,gpu -max_num_threads=1024 -model=tx2 -thread_warp_size=32", "conv2d_NCHWc_int8.cuda", [["TENSOR", [1, 4, 514, 514], "int8"], ["TENSOR", [32, 4, 3, 3], "int8"], [2, 2], [0, 0, 0, 0], [1, 1], "NCHW", "int32"], {}], "config": {"index": 66528015, "code_hash": null, "entity": [["tile_n", "sp", [-1, 1, 1, 1]], ["tile_f", "sp", [-1, 1, 4, 2]], ["tile_y", "sp", [-1, 1, 1, 1]], ["tile_x", "sp", [-1, 1, 16, 1]], ["fuse_yx", "ot", 0], ["tile_rc", "sp", [-1, 1]], ["tile_ry", "sp", [-1, 3]], ["tile_rx", "sp", [-1, 1]], ["reorder_inner", "re", [1, 2, 0]], ["AA_double_buffer", "ot", 0], ["WW_double_buffer", "ot", 1], ["auto_unroll_max_step", "ot", 0]]}, "result": [[0.0002085261860670194], 0, 21.882616758346558, 1615396467.4376607], "version": 0.2, "tvm_version": "0.8.dev0"}
{"input": ["cuda -keys=cuda,gpu -max_num_threads=1024 -model=tx2 -thread_warp_size=32", "depthwise_conv2d_nchw.cuda", [["TENSOR", [1, 32, 258, 258], "int8"], ["TENSOR", [32, 1, 3, 3], "int8"], [1, 1], [0, 0, 0, 0], [1, 1], "int32"], {}], "config": {"index": 8279656, "code_hash": null, "entity": [["tile_f", "sp", [-1, 1, 1, 1]], ["tile_y", "sp", [-1, 4, 2, 1]], ["tile_x", "sp", [-1, 1, 16, 2]], ["auto_unroll_max_step", "ot", 1500], ["unroll_explicit", "ot", 1]]}, "result": [[0.00022964644995140913], 0, 37.69369578361511, 1615398712.6287274], "version": 0.2, "tvm_version": "0.8.dev0"}
{"input": ["cuda -keys=cuda,gpu -max_num_threads=1024 -model=tx2 -thread_warp_size=32", "conv2d_NCHWc_int8.cuda", [["TENSOR", [1, 32, 256, 256], "int8"], ["TENSOR", [16, 32, 1, 1], "int8"], [1, 1], [0, 0, 0, 0], [1, 1], "NCHW", "int32"], {}], "config": {"index": 3603605, "code_hash": null, "entity": [["tile_n", "sp", [-1, 1, 1, 1]], ["tile_f", "sp", [-1, 1, 4, 1]], ["tile_y", "sp", [-1, 1, 1, 1]], ["tile_x", "sp", [-1, 1, 64, 1]], ["fuse_yx", "ot", 1], ["tile_rc", "sp", [-1, 4]], ["tile_ry", "sp", [-1, 1]], ["tile_rx", "sp", [-1, 1]], ["reorder_inner", "re", [0, 2, 1]], ["AA_double_buffer", "ot", 0], ["WW_double_buffer", "ot", 0], ["auto_unroll_max_step", "ot", 0]]}, "result": [[0.0001369190957632037], 0, 27.694319248199463, 1615403334.1143003], "version": 0.2, "tvm_version": "0.8.dev0"}
{"input": ["cuda -keys=cuda,gpu -max_num_threads=1024 -model=tx2 -thread_warp_size=32", "conv2d_NCHWc_int8.cuda", [["TENSOR", [1, 16, 256, 256], "int8"], ["TENSOR", [96, 16, 1, 1], "int8"], [1, 1], [0, 0, 0, 0], [1, 1], "NCHW", "int32"], {}], "config": {"index": 655894847, "code_hash": null, "entity": [["tile_n", "sp", [-1, 1, 1, 1]], ["tile_f", "sp", [-1, 1, 12, 2]], ["tile_y", "sp", [-1, 1, 1, 1]], ["tile_x", "sp", [-1, 1, 8, 1]], ["fuse_yx", "ot", 1], ["tile_rc", "sp", [-1, 1]], ["tile_ry", "sp", [-1, 1]], ["tile_rx", "sp", [-1, 1]], ["reorder_inner", "re", [1, 0, 2]], ["AA_double_buffer", "ot", 0], ["WW_double_buffer", "ot", 0], ["auto_unroll_max_step", "ot", 1500]]}, "result": [[0.0005794214987951807], 0, 54.83245086669922, 1615411335.4509637], "version": 0.2, "tvm_version": "0.8.dev0"}
{"input": ["cuda -keys=cuda,gpu -max_num_threads=1024 -model=tx2 -thread_warp_size=32", "depthwise_conv2d_nchw.cuda", [["TENSOR", [1, 96, 258, 258], "int8"], ["TENSOR", [96, 1, 3, 3], "int8"], [2, 2], [0, 0, 0, 0], [1, 1], "int32"], {}], "config": {"index": 13803776, "code_hash": null, "entity": [["tile_f", "sp", [-1, 1, 1, 1]], ["tile_y", "sp", [-1, 1, 1, 4]], ["tile_x", "sp", [-1, 1, 64, 1]], ["auto_unroll_max_step", "ot", 256], ["unroll_explicit", "ot", 1]]}, "result": [[0.0002755866740139211], 0, 10.583125352859497, 1615416005.8301752], "version": 0.2, "tvm_version": "0.8.dev0"}
{"input": ["cuda -keys=cuda,gpu -max_num_threads=1024 -model=tx2 -thread_warp_size=32", "conv2d_NCHWc_int8.cuda", [["TENSOR", [1, 96, 128, 128], "int8"], ["TENSOR", [24, 96, 1, 1], "int8"], [1, 1], [0, 0, 0, 0], [1, 1], "NCHW", "int32"], {}], "config": {"index": 264793543, "code_hash": null, "entity": [["tile_n", "sp", [-1, 1, 1, 1]], ["tile_f", "sp", [-1, 2, 3, 1]], ["tile_y", "sp", [-1, 1, 1, 2]], ["tile_x", "sp", [-1, 1, 64, 1]], ["fuse_yx", "ot", 1], ["tile_rc", "sp", [-1, 12]], ["tile_ry", "sp", [-1, 1]], ["tile_rx", "sp", [-1, 1]], ["reorder_inner", "re", [2, 1, 0]], ["AA_double_buffer", "ot", 1], ["WW_double_buffer", "ot", 1], ["auto_unroll_max_step", "ot", 1500]]}, "result": [[6.954660650982919e-05], 0, 28.903560161590576, 1615423169.8092914], "version": 0.2, "tvm_version": "0.8.dev0"}
{"input": ["cuda -keys=cuda,gpu -max_num_threads=1024 -model=tx2 -thread_warp_size=32", "depthwise_conv2d_nchw.cuda", [["TENSOR", [1, 144, 130, 130], "int8"], ["TENSOR", [144, 1, 3, 3], "int8"], [1, 1], [0, 0, 0, 0], [1, 1], "int32"], {}], "config": {"index": 26349400, "code_hash": null, "entity": [["tile_f", "sp", [-1, 1, 1, 1]], ["tile_y", "sp", [-1, 2, 2, 2]], ["tile_x", "sp", [-1, 2, 16, 1]], ["auto_unroll_max_step", "ot", 1500], ["unroll_explicit", "ot", 1]]}, "result": [[0.00025785934270270274], 0, 38.41457223892212, 1615429211.3262749], "version": 0.2, "tvm_version": "0.8.dev0"}
{"input": ["cuda -keys=cuda,gpu -max_num_threads=1024 -model=tx2 -thread_warp_size=32", "conv2d_NCHWc_int8.cuda", [["TENSOR", [1, 144, 128, 128], "int8"], ["TENSOR", [24, 144, 1, 1], "int8"], [1, 1], [0, 0, 0, 0], [1, 1], "NCHW", "int32"], {}], "config": {"index": 255347143, "code_hash": null, "entity": [["tile_n", "sp", [-1, 1, 1, 1]], ["tile_f", "sp", [-1, 2, 3, 1]], ["tile_y", "sp", [-1, 1, 1, 2]], ["tile_x", "sp", [-1, 1, 64, 1]], ["fuse_yx", "ot", 0], ["tile_rc", "sp", [-1, 9]], ["tile_ry", "sp", [-1, 1]], ["tile_rx", "sp", [-1, 1]], ["reorder_inner", "re", [0, 2, 1]], ["AA_double_buffer", "ot", 0], ["WW_double_buffer", "ot", 1], ["auto_unroll_max_step", "ot", 1500]]}, "result": [[8.650433059548255e-05], 0, 30.935046672821045, 1615432507.6139345], "version": 0.2, "tvm_version": "0.8.dev0"}
{"input": ["cuda -keys=cuda,gpu -max_num_threads=1024 -model=tx2 -thread_warp_size=32", "conv2d_NCHWc_int8.cuda", [["TENSOR", [1, 24, 128, 128], "int8"], ["TENSOR", [144, 24, 1, 1], "int8"], [1, 1], [0, 0, 0, 0], [1, 1], "NCHW", "int32"], {}], "config": {"index": 659832030, "code_hash": null, "entity": [["tile_n", "sp", [-1, 1, 1, 1]], ["tile_f", "sp", [-1, 4, 9, 1]], ["tile_y", "sp", [-1, 1, 1, 1]], ["tile_x", "sp", [-1, 1, 16, 1]], ["fuse_yx", "ot", 0], ["tile_rc", "sp", [-1, 2]], ["tile_ry", "sp", [-1, 1]], ["tile_rx", "sp", [-1, 1]], ["reorder_inner", "re", [1, 2, 0]], ["AA_double_buffer", "ot", 1], ["WW_double_buffer", "ot", 0], ["auto_unroll_max_step", "ot", 1500]]}, "result": [[0.00021807433946642135], 0, 16.645371675491333, 1615437318.7869883], "version": 0.2, "tvm_version": "0.8.dev0"}
{"input": ["cuda -keys=cuda,gpu -max_num_threads=1024 -model=tx2 -thread_warp_size=32", "depthwise_conv2d_nchw.cuda", [["TENSOR", [1, 144, 130, 130], "int8"], ["TENSOR", [144, 1, 3, 3], "int8"], [2, 2], [0, 0, 0, 0], [1, 1], "int32"], {}], "config": {"index": 13101900, "code_hash": null, "entity": [["tile_f", "sp", [-1, 1, 1, 1]], ["tile_y", "sp", [-1, 1, 2, 4]], ["tile_x", "sp", [-1, 1, 32, 1]], ["auto_unroll_max_step", "ot", 1500], ["unroll_explicit", "ot", 1]]}, "result": [[0.00010587239792550684], 0, 13.84665584564209, 1615441017.726051], "version": 0.2, "tvm_version": "0.8.dev0"}
{"input": ["cuda -keys=cuda,gpu -max_num_threads=1024 -model=tx2 -thread_warp_size=32", "conv2d_NCHWc_int8.cuda", [["TENSOR", [1, 144, 64, 64], "int8"], ["TENSOR", [32, 144, 1, 1], "int8"], [1, 1], [0, 0, 0, 0], [1, 1], "NCHW", "int32"], {}], "config": {"index": 131848648, "code_hash": null, "entity": [["tile_n", "sp", [-1, 1, 1, 1]], ["tile_f", "sp", [-1, 2, 4, 1]], ["tile_y", "sp", [-1, 1, 1, 2]], ["tile_x", "sp", [-1, 1, 32, 1]], ["fuse_yx", "ot", 0], ["tile_rc", "sp", [-1, 36]], ["tile_ry", "sp", [-1, 1]], ["tile_rx", "sp", [-1, 1]], ["reorder_inner", "re", [1, 2, 0]], ["AA_double_buffer", "ot", 0], ["WW_double_buffer", "ot", 0], ["auto_unroll_max_step", "ot", 1500]]}, "result": [[2.6990345094086022e-05], 0, 11.348825216293335, 1615444451.671525], "version": 0.2, "tvm_version": "0.8.dev0"}
{"input": ["cuda -keys=cuda,gpu -max_num_threads=1024 -model=tx2 -thread_warp_size=32", "depthwise_conv2d_nchw.cuda", [["TENSOR", [1, 192, 66, 66], "int8"], ["TENSOR", [192, 1, 3, 3], "int8"], [1, 1], [0, 0, 0, 0], [1, 1], "int32"], {}], "config": {"index": 7893984, "code_hash": null, "entity": [["tile_f", "sp", [-1, 1, 1, 1]], ["tile_y", "sp", [-1, 1, 4, 4]], ["tile_x", "sp", [-1, 1, 64, 1]], ["auto_unroll_max_step", "ot", 0], ["unroll_explicit", "ot", 1]]}, "result": [[8.774858748977922e-05], 0, 6.067012786865234, 1615447431.5248735], "version": 0.2, "tvm_version": "0.8.dev0"}
{"input": ["cuda -keys=cuda,gpu -max_num_threads=1024 -model=tx2 -thread_warp_size=32", "conv2d_NCHWc_int8.cuda", [["TENSOR", [1, 192, 64, 64], "int8"], ["TENSOR", [32, 192, 1, 1], "int8"], [1, 1], [0, 0, 0, 0], [1, 1], "NCHW", "int32"], {}], "config": {"index": 103906888, "code_hash": null, "entity": [["tile_n", "sp", [-1, 1, 1, 1]], ["tile_f", "sp", [-1, 2, 4, 1]], ["tile_y", "sp", [-1, 1, 1, 2]], ["tile_x", "sp", [-1, 1, 32, 1]], ["fuse_yx", "ot", 0], ["tile_rc", "sp", [-1, 24]], ["tile_ry", "sp", [-1, 1]], ["tile_rx", "sp", [-1, 1]], ["reorder_inner", "re", [0, 1, 2]], ["AA_double_buffer", "ot", 0], ["WW_double_buffer", "ot", 1], ["auto_unroll_max_step", "ot", 512]]}, "result": [[3.136926146629604e-05], 0, 11.467358589172363, 1615452108.2363746], "version": 0.2, "tvm_version": "0.8.dev0"}
{"input": ["cuda -keys=cuda,gpu -max_num_threads=1024 -model=tx2 -thread_warp_size=32", "conv2d_NCHWc_int8.cuda", [["TENSOR", [1, 32, 64, 64], "int8"], ["TENSOR", [192, 32, 1, 1], "int8"], [1, 1], [0, 0, 0, 0], [1, 1], "NCHW", "int32"], {}], "config": {"index": 155349611, "code_hash": null, "entity": [["tile_n", "sp", [-1, 1, 1, 1]], ["tile_f", "sp", [-1, 2, 2, 1]], ["tile_y", "sp", [-1, 1, 1, 1]], ["tile_x", "sp", [-1, 1, 16, 1]], ["fuse_yx", "ot", 1], ["tile_rc", "sp", [-1, 4]], ["tile_ry", "sp", [-1, 1]], ["tile_rx", "sp", [-1, 1]], ["reorder_inner", "re", [0, 2, 1]], ["AA_double_buffer", "ot", 1], ["WW_double_buffer", "ot", 1], ["auto_unroll_max_step", "ot", 0]]}, "result": [[7.371149315068493e-05], 0, 20.91579556465149, 1615458987.542327], "version": 0.2, "tvm_version": "0.8.dev0"}
{"input": ["cuda -keys=cuda,gpu -max_num_threads=1024 -model=tx2 -thread_warp_size=32", "depthwise_conv2d_nchw.cuda", [["TENSOR", [1, 192, 66, 66], "int8"], ["TENSOR", [192, 1, 3, 3], "int8"], [2, 2], [0, 0, 0, 0], [1, 1], "int32"], {}], "config": {"index": 5659248, "code_hash": null, "entity": [["tile_f", "sp", [-1, 1, 1, 1]], ["tile_y", "sp", [-1, 1, 4, 4]], ["tile_x", "sp", [-1, 1, 32, 1]], ["auto_unroll_max_step", "ot", 1500], ["unroll_explicit", "ot", 1]]}, "result": [[3.8991010561892696e-05], 0, 4.984855651855469, 1615461656.3922975], "version": 0.2, "tvm_version": "0.8.dev0"}
{"input": ["cuda -keys=cuda,gpu -max_num_threads=1024 -model=tx2 -thread_warp_size=32", "conv2d_NCHWc_int8.cuda", [["TENSOR", [1, 192, 32, 32], "int8"], ["TENSOR", [64, 192, 1, 1], "int8"], [1, 1], [0, 0, 0, 0], [1, 1], "NCHW", "int32"], {}], "config": {"index": 7832193, "code_hash": null, "entity": [["tile_n", "sp", [-1, 1, 1, 1]], ["tile_f", "sp", [-1, 1, 2, 8]], ["tile_y", "sp", [-1, 1, 1, 1]], ["tile_x", "sp", [-1, 1, 32, 1]], ["fuse_yx", "ot", 1], ["tile_rc", "sp", [-1, 8]], ["tile_ry", "sp", [-1, 1]], ["tile_rx", "sp", [-1, 1]], ["reorder_inner", "re", [1, 2, 0]], ["AA_double_buffer", "ot", 0], ["WW_double_buffer", "ot", 0], ["auto_unroll_max_step", "ot", 0]]}, "result": [[1.6957665226781856e-05], 0, 14.002837896347046, 1615467133.7164588], "version": 0.2, "tvm_version": "0.8.dev0"}
{"input": ["cuda -keys=cuda,gpu -max_num_threads=1024 -model=tx2 -thread_warp_size=32", "conv2d_NCHWc_int8.cuda", [["TENSOR", [1, 384, 32, 32], "int8"], ["TENSOR", [64, 384, 1, 1], "int8"], [1, 1], [0, 0, 0, 0], [1, 1], "NCHW", "int32"], {}], "config": {"index": 167204437, "code_hash": null, "entity": [["tile_n", "sp", [-1, 1, 1, 1]], ["tile_f", "sp", [-1, 1, 4, 2]], ["tile_y", "sp", [-1, 1, 1, 2]], ["tile_x", "sp", [-1, 1, 32, 1]], ["fuse_yx", "ot", 1], ["tile_rc", "sp", [-1, 8]], ["tile_ry", "sp", [-1, 1]], ["tile_rx", "sp", [-1, 1]], ["reorder_inner", "re", [1, 2, 0]], ["AA_double_buffer", "ot", 0], ["WW_double_buffer", "ot", 1], ["auto_unroll_max_step", "ot", 1500]]}, "result": [[2.7314528477057668e-05], 0, 15.787508010864258, 1615474692.8477364], "version": 0.2, "tvm_version": "0.8.dev0"}
{"input": ["cuda -keys=cuda,gpu -max_num_threads=1024 -model=tx2 -thread_warp_size=32", "conv2d_NCHWc_int8.cuda", [["TENSOR", [1, 64, 32, 32], "int8"], ["TENSOR", [384, 64, 1, 1], "int8"], [1, 1], [0, 0, 0, 0], [1, 1], "NCHW", "int32"], {}], "config": {"index": 475819038, "code_hash": null, "entity": [["tile_n", "sp", [-1, 1, 1, 1]], ["tile_f", "sp", [-1, 3, 4, 1]], ["tile_y", "sp", [-1, 1, 1, 1]], ["tile_x", "sp", [-1, 1, 32, 1]], ["fuse_yx", "ot", 1], ["tile_rc", "sp", [-1, 8]], ["tile_ry", "sp", [-1, 1]], ["tile_rx", "sp", [-1, 1]], ["reorder_inner", "re", [0, 2, 1]], ["AA_double_buffer", "ot", 1], ["WW_double_buffer", "ot", 1], ["auto_unroll_max_step", "ot", 1500]]}, "result": [[3.933832697127434e-05], 0, 18.975741147994995, 1615482508.6121457], "version": 0.2, "tvm_version": "0.8.dev0"}
{"input": ["cuda -keys=cuda,gpu -max_num_threads=1024 -model=tx2 -thread_warp_size=32", "depthwise_conv2d_nchw.cuda", [["TENSOR", [1, 384, 34, 34], "int8"], ["TENSOR", [384, 1, 3, 3], "int8"], [1, 1], [0, 0, 0, 0], [1, 1], "int32"], {}], "config": {"index": 8053440, "code_hash": null, "entity": [["tile_f", "sp", [-1, 1, 1, 1]], ["tile_y", "sp", [-1, 2, 8, 2]], ["tile_x", "sp", [-1, 2, 16, 1]], ["auto_unroll_max_step", "ot", 1500], ["unroll_explicit", "ot", 1]]}, "result": [[4.607750011756407e-05], 0, 22.155062675476074, 1615483179.1940968], "version": 0.2, "tvm_version": "0.8.dev0"}
{"input": ["cuda -keys=cuda,gpu -max_num_threads=1024 -model=tx2 -thread_warp_size=32", "conv2d_NCHWc_int8.cuda", [["TENSOR", [1, 384, 32, 32], "int8"], ["TENSOR", [96, 384, 1, 1], "int8"], [1, 1], [0, 0, 0, 0], [1, 1], "NCHW", "int32"], {}], "config": {"index": 388202683, "code_hash": null, "entity": [["tile_n", "sp", [-1, 1, 1, 1]], ["tile_f", "sp", [-1, 1, 4, 2]], ["tile_y", "sp", [-1, 1, 1, 2]], ["tile_x", "sp", [-1, 1, 32, 1]], ["fuse_yx", "ot", 1], ["tile_rc", "sp", [-1, 8]], ["tile_ry", "sp", [-1, 1]], ["tile_rx", "sp", [-1, 1]], ["reorder_inner", "re", [2, 0, 1]], ["AA_double_buffer", "ot", 0], ["WW_double_buffer", "ot", 1], ["auto_unroll_max_step", "ot", 1500]]}, "result": [[3.478848169113745e-05], 0, 15.468394994735718, 1615486729.0157633], "version": 0.2, "tvm_version": "0.8.dev0"}
{"input": ["cuda -keys=cuda,gpu -max_num_threads=1024 -model=tx2 -thread_warp_size=32", "depthwise_conv2d_nchw.cuda", [["TENSOR", [1, 576, 34, 34], "int8"], ["TENSOR", [576, 1, 3, 3], "int8"], [1, 1], [0, 0, 0, 0], [1, 1], "int32"], {}], "config": {"index": 6153000, "code_hash": null, "entity": [["tile_f", "sp", [-1, 1, 1, 1]], ["tile_y", "sp", [-1, 1, 8, 4]], ["tile_x", "sp", [-1, 1, 16, 1]], ["auto_unroll_max_step", "ot", 1500], ["unroll_explicit", "ot", 0]]}, "result": [[6.744360306537379e-05], 0, 32.65555930137634, 1615490345.91465], "version": 0.2, "tvm_version": "0.8.dev0"}
{"input": ["cuda -keys=cuda,gpu -max_num_threads=1024 -model=tx2 -thread_warp_size=32", "conv2d_NCHWc_int8.cuda", [["TENSOR", [1, 576, 32, 32], "int8"], ["TENSOR", [96, 576, 1, 1], "int8"], [1, 1], [0, 0, 0, 0], [1, 1], "NCHW", "int32"], {}], "config": {"index": 214844603, "code_hash": null, "entity": [["tile_n", "sp", [-1, 1, 1, 1]], ["tile_f", "sp", [-1, 1, 4, 2]], ["tile_y", "sp", [-1, 1, 1, 2]], ["tile_x", "sp", [-1, 1, 32, 1]], ["fuse_yx", "ot", 0], ["tile_rc", "sp", [-1, 16]], ["tile_ry", "sp", [-1, 1]], ["tile_rx", "sp", [-1, 1]], ["reorder_inner", "re", [2, 0, 1]], ["AA_double_buffer", "ot", 0], ["WW_double_buffer", "ot", 0], ["auto_unroll_max_step", "ot", 512]]}, "result": [[5.1417347804878044e-05], 0, 14.466680526733398, 1615494116.5657017], "version": 0.2, "tvm_version": "0.8.dev0"}
{"input": ["cuda -keys=cuda,gpu -max_num_threads=1024 -model=tx2 -thread_warp_size=32", "conv2d_NCHWc_int8.cuda", [["TENSOR", [1, 96, 32, 32], "int8"], ["TENSOR", [576, 96, 1, 1], "int8"], [1, 1], [0, 0, 0, 0], [1, 1], "NCHW", "int32"], {}], "config": {"index": 1206661869, "code_hash": null, "entity": [["tile_n", "sp", [-1, 1, 1, 1]], ["tile_f", "sp", [-1, 1, 4, 2]], ["tile_y", "sp", [-1, 1, 1, 2]], ["tile_x", "sp", [-1, 1, 32, 1]], ["fuse_yx", "ot", 1], ["tile_rc", "sp", [-1, 8]], ["tile_ry", "sp", [-1, 1]], ["tile_rx", "sp", [-1, 1]], ["reorder_inner", "re", [1, 0, 2]], ["AA_double_buffer", "ot", 1], ["WW_double_buffer", "ot", 1], ["auto_unroll_max_step", "ot", 1500]]}, "result": [[5.742284045191513e-05], 0, 29.368773460388184, 1615497090.1790395], "version": 0.2, "tvm_version": "0.8.dev0"}
{"input": ["cuda -keys=cuda,gpu -max_num_threads=1024 -model=tx2 -thread_warp_size=32", "depthwise_conv2d_nchw.cuda", [["TENSOR", [1, 576, 34, 34], "int8"], ["TENSOR", [576, 1, 3, 3], "int8"], [2, 2], [0, 0, 0, 0], [1, 1], "int32"], {}], "config": {"index": 5507040, "code_hash": null, "entity": [["tile_f", "sp", [-1, 1, 1, 1]], ["tile_y", "sp", [-1, 4, 4, 1]], ["tile_x", "sp", [-1, 1, 8, 1]], ["auto_unroll_max_step", "ot", 1500], ["unroll_explicit", "ot", 1]]}, "result": [[3.191668248113998e-05], 0, 3.829218626022339, 1615500681.7252846], "version": 0.2, "tvm_version": "0.8.dev0"}
{"input": ["cuda -keys=cuda,gpu -max_num_threads=1024 -model=tx2 -thread_warp_size=32", "conv2d_NCHWc_int8.cuda", [["TENSOR", [1, 576, 16, 16], "int8"], ["TENSOR", [160, 576, 1, 1], "int8"], [1, 1], [0, 0, 0, 0], [1, 1], "NCHW", "int32"], {}], "config": {"index": 168992422, "code_hash": null, "entity": [["tile_n", "sp", [-1, 1, 1, 1]], ["tile_f", "sp", [-1, 1, 8, 1]], ["tile_y", "sp", [-1, 1, 1, 2]], ["tile_x", "sp", [-1, 1, 16, 1]], ["fuse_yx", "ot", 0], ["tile_rc", "sp", [-1, 12]], ["tile_ry", "sp", [-1, 1]], ["tile_rx", "sp", [-1, 1]], ["reorder_inner", "re", [1, 2, 0]], ["AA_double_buffer", "ot", 1], ["WW_double_buffer", "ot", 0], ["auto_unroll_max_step", "ot", 1500]]}, "result": [[2.5578760543928608e-05], 0, 23.493159532546997, 1615504091.3427272], "version": 0.2, "tvm_version": "0.8.dev0"}
{"input": ["cuda -keys=cuda,gpu -max_num_threads=1024 -model=tx2 -thread_warp_size=32", "conv2d_NCHWc_int8.cuda", [["TENSOR", [1, 960, 16, 16], "int8"], ["TENSOR", [160, 960, 1, 1], "int8"], [1, 1], [0, 0, 0, 0], [1, 1], "NCHW", "int32"], {}], "config": {"index": 198490422, "code_hash": null, "entity": [["tile_n", "sp", [-1, 1, 1, 1]], ["tile_f", "sp", [-1, 1, 8, 1]], ["tile_y", "sp", [-1, 1, 1, 2]], ["tile_x", "sp", [-1, 1, 16, 1]], ["fuse_yx", "ot", 1], ["tile_rc", "sp", [-1, 24]], ["tile_ry", "sp", [-1, 1]], ["tile_rx", "sp", [-1, 1]], ["reorder_inner", "re", [1, 0, 2]], ["AA_double_buffer", "ot", 0], ["WW_double_buffer", "ot", 0], ["auto_unroll_max_step", "ot", 1500]]}, "result": [[4.2465753065890667e-05], 0, 24.603561401367188, 1615508560.4685266], "version": 0.2, "tvm_version": "0.8.dev0"}
{"input": ["cuda -keys=cuda,gpu -max_num_threads=1024 -model=tx2 -thread_warp_size=32", "conv2d_NCHWc_int8.cuda", [["TENSOR", [1, 160, 16, 16], "int8"], ["TENSOR", [960, 160, 1, 1], "int8"], [1, 1], [0, 0, 0, 0], [1, 1], "NCHW", "int32"], {}], "config": {"index": 537420877, "code_hash": null, "entity": [["tile_n", "sp", [-1, 1, 1, 1]], ["tile_f", "sp", [-1, 2, 8, 1]], ["tile_y", "sp", [-1, 1, 1, 2]], ["tile_x", "sp", [-1, 1, 16, 1]], ["fuse_yx", "ot", 1], ["tile_rc", "sp", [-1, 40]], ["tile_ry", "sp", [-1, 1]], ["tile_rx", "sp", [-1, 1]], ["reorder_inner", "re", [0, 1, 2]], ["AA_double_buffer", "ot", 0], ["WW_double_buffer", "ot", 0], ["auto_unroll_max_step", "ot", 1500]]}, "result": [[3.736983819141612e-05], 0, 2.7954261302948, 1615512677.0303767], "version": 0.2, "tvm_version": "0.8.dev0"}
{"input": ["cuda -keys=cuda,gpu -max_num_threads=1024 -model=tx2 -thread_warp_size=32", "depthwise_conv2d_nchw.cuda", [["TENSOR", [1, 960, 18, 18], "int8"], ["TENSOR", [960, 1, 3, 3], "int8"], [1, 1], [0, 0, 0, 0], [1, 1], "int32"], {}], "config": {"index": 8887900, "code_hash": null, "entity": [["tile_f", "sp", [-1, 1, 2, 1]], ["tile_y", "sp", [-1, 1, 2, 8]], ["tile_x", "sp", [-1, 2, 8, 1]], ["auto_unroll_max_step", "ot", 1500], ["unroll_explicit", "ot", 1]]}, "result": [[3.086879932885906e-05], 0, 3.7074573040008545, 1615517398.9065213], "version": 0.2, "tvm_version": "0.8.dev0"}
{"input": ["cuda -keys=cuda,gpu -max_num_threads=1024 -model=tx2 -thread_warp_size=32", "conv2d_NCHWc_int8.cuda", [["TENSOR", [1, 960, 16, 16], "int8"], ["TENSOR", [320, 960, 1, 1], "int8"], [1, 1], [0, 0, 0, 0], [1, 1], "NCHW", "int32"], {}], "config": {"index": 257320730, "code_hash": null, "entity": [["tile_n", "sp", [-1, 1, 1, 1]], ["tile_f", "sp", [-1, 2, 8, 1]], ["tile_y", "sp", [-1, 1, 1, 2]], ["tile_x", "sp", [-1, 1, 16, 1]], ["fuse_yx", "ot", 0], ["tile_rc", "sp", [-1, 16]], ["tile_ry", "sp", [-1, 1]], ["tile_rx", "sp", [-1, 1]], ["reorder_inner", "re", [0, 2, 1]], ["AA_double_buffer", "ot", 0], ["WW_double_buffer", "ot", 1], ["auto_unroll_max_step", "ot", 512]]}, "result": [[6.826424165856818e-05], 0, 17.145627737045288, 1615521657.2811587], "version": 0.2, "tvm_version": "0.8.dev0"}
{"input": ["cuda -keys=cuda,gpu -max_num_threads=1024 -model=tx2 -thread_warp_size=32", "conv2d_NCHWc_int8.cuda", [["TENSOR", [1, 320, 16, 16], "int8"], ["TENSOR", [1280, 320, 1, 1], "int8"], [1, 1], [0, 0, 0, 0], [1, 1], "NCHW", "int32"], {}], "config": {"index": 441816524, "code_hash": null, "entity": [["tile_n", "sp", [-1, 1, 1, 1]], ["tile_f", "sp", [-1, 2, 8, 1]], ["tile_y", "sp", [-1, 1, 1, 2]], ["tile_x", "sp", [-1, 1, 16, 1]], ["fuse_yx", "ot", 1], ["tile_rc", "sp", [-1, 16]], ["tile_ry", "sp", [-1, 1]], ["tile_rx", "sp", [-1, 1]], ["reorder_inner", "re", [2, 1, 0]], ["AA_double_buffer", "ot", 0], ["WW_double_buffer", "ot", 0], ["auto_unroll_max_step", "ot", 1500]]}, "result": [[8.361072493985566e-05], 0, 4.705724239349365, 1615524396.8064644], "version": 0.2, "tvm_version": "0.8.dev0"}
{"input": ["cuda -keys=cuda,gpu -max_num_threads=1024 -model=tx2 -thread_warp_size=32", "conv2d_NCHWc_int8.cuda", [["TENSOR", [1, 1280, 16, 16], "int8"], ["TENSOR", [512, 1280, 1, 1], "int8"], [1, 1], [0, 0, 0, 0], [1, 1], "NCHW", "int32"], {}], "config": {"index": 116484654, "code_hash": null, "entity": [["tile_n", "sp", [-1, 1, 1, 1]], ["tile_f", "sp", [-1, 1, 8, 2]], ["tile_y", "sp", [-1, 1, 1, 2]], ["tile_x", "sp", [-1, 1, 16, 1]], ["fuse_yx", "ot", 0], ["tile_rc", "sp", [-1, 8]], ["tile_ry", "sp", [-1, 1]], ["tile_rx", "sp", [-1, 1]], ["reorder_inner", "re", [2, 0, 1]], ["AA_double_buffer", "ot", 0], ["WW_double_buffer", "ot", 0], ["auto_unroll_max_step", "ot", 512]]}, "result": [[0.00013325259380479252], 0, 9.809011697769165, 1615529482.4701514], "version": 0.2, "tvm_version": "0.8.dev0"}
{"input": ["cuda -keys=cuda,gpu -max_num_threads=1024 -model=tx2 -thread_warp_size=32", "depthwise_conv2d_nchw.cuda", [["TENSOR", [1, 512, 18, 18], "int8"], ["TENSOR", [512, 1, 3, 3], "int8"], [1, 1], [0, 0, 0, 0], [1, 1], "int32"], {}], "config": {"index": 1462367, "code_hash": null, "entity": [["tile_f", "sp", [-1, 1, 8, 1]], ["tile_y", "sp", [-1, 2, 1, 8]], ["tile_x", "sp", [-1, 1, 16, 1]], ["auto_unroll_max_step", "ot", 1500], ["unroll_explicit", "ot", 1]]}, "result": [[1.7779459006671607e-05], 0, 19.898183345794678, 1615537089.9847798], "version": 0.2, "tvm_version": "0.8.dev0"}
{"input": ["cuda -keys=cuda,gpu -max_num_threads=1024 -model=tx2 -thread_warp_size=32", "conv2d_NCHWc_int8.cuda", [["TENSOR", [1, 512, 16, 16], "int8"], ["TENSOR", [1024, 512, 1, 1], "int8"], [1, 1], [0, 0, 0, 0], [1, 1], "NCHW", "int32"], {}], "config": {"index": 156934035, "code_hash": null, "entity": [["tile_n", "sp", [-1, 1, 1, 1]], ["tile_f", "sp", [-1, 1, 4, 2]], ["tile_y", "sp", [-1, 1, 1, 4]], ["tile_x", "sp", [-1, 1, 16, 1]], ["fuse_yx", "ot", 0], ["tile_rc", "sp", [-1, 16]], ["tile_ry", "sp", [-1, 1]], ["tile_rx", "sp", [-1, 1]], ["reorder_inner", "re", [0, 1, 2]], ["AA_double_buffer", "ot", 0], ["WW_double_buffer", "ot", 0], ["auto_unroll_max_step", "ot", 1500]]}, "result": [[0.00010265920604914935], 0, 20.331734895706177, 1615539774.1180422], "version": 0.2, "tvm_version": "0.8.dev0"}
{"input": ["cuda -keys=cuda,gpu -max_num_threads=1024 -model=tx2 -thread_warp_size=32", "conv2d_NCHWc_int8.cuda", [["TENSOR", [1, 1024, 16, 16], "int8"], ["TENSOR", [512, 1024, 1, 1], "int8"], [1, 1], [0, 0, 0, 0], [1, 1], "NCHW", "int32"], {}], "config": {"index": 133683654, "code_hash": null, "entity": [["tile_n", "sp", [-1, 1, 1, 1]], ["tile_f", "sp", [-1, 1, 8, 2]], ["tile_y", "sp", [-1, 1, 1, 2]], ["tile_x", "sp", [-1, 1, 16, 1]], ["fuse_yx", "ot", 1], ["tile_rc", "sp", [-1, 16]], ["tile_ry", "sp", [-1, 1]], ["tile_rx", "sp", [-1, 1]], ["reorder_inner", "re", [1, 0, 2]], ["AA_double_buffer", "ot", 0], ["WW_double_buffer", "ot", 0], ["auto_unroll_max_step", "ot", 1500]]}, "result": [[0.00010782233736104399], 0, 20.35564613342285, 1615546550.3830955], "version": 0.2, "tvm_version": "0.8.dev0"}
{"input": ["cuda -keys=cuda,gpu -max_num_threads=1024 -model=tx2 -thread_warp_size=32", "conv2d_NCHWc_int8.cuda", [["TENSOR", [1, 512, 16, 16], "int8"], ["TENSOR", [256, 512, 1, 1], "int8"], [1, 1], [0, 0, 0, 0], [1, 1], "NCHW", "int32"], {}], "config": {"index": 81539263, "code_hash": null, "entity": [["tile_n", "sp", [-1, 1, 1, 1]], ["tile_f", "sp", [-1, 1, 8, 2]], ["tile_y", "sp", [-1, 1, 1, 2]], ["tile_x", "sp", [-1, 1, 16, 1]], ["fuse_yx", "ot", 0], ["tile_rc", "sp", [-1, 16]], ["tile_ry", "sp", [-1, 1]], ["tile_rx", "sp", [-1, 1]], ["reorder_inner", "re", [0, 2, 1]], ["AA_double_buffer", "ot", 0], ["WW_double_buffer", "ot", 0], ["auto_unroll_max_step", "ot", 1500]]}, "result": [[3.379670129161361e-05], 0, 5.153125762939453, 1615552278.0421023], "version": 0.2, "tvm_version": "0.8.dev0"}
{"input": ["cuda -keys=cuda,gpu -max_num_threads=1024 -model=tx2 -thread_warp_size=32", "conv2d_NCHWc_int8.cuda", [["TENSOR", [1, 352, 32, 32], "int8"], ["TENSOR", [256, 352, 1, 1], "int8"], [1, 1], [0, 0, 0, 0], [1, 1], "NCHW", "int32"], {}], "config": {"index": 275900811, "code_hash": null, "entity": [["tile_n", "sp", [-1, 1, 1, 1]], ["tile_f", "sp", [-1, 1, 4, 2]], ["tile_y", "sp", [-1, 1, 1, 2]], ["tile_x", "sp", [-1, 1, 32, 1]], ["fuse_yx", "ot", 1], ["tile_rc", "sp", [-1, 8]], ["tile_ry", "sp", [-1, 1]], ["tile_rx", "sp", [-1, 1]], ["reorder_inner", "re", [2, 1, 0]], ["AA_double_buffer", "ot", 0], ["WW_double_buffer", "ot", 1], ["auto_unroll_max_step", "ot", 1500]]}, "result": [[7.449757178482366e-05], 0, 23.64950966835022, 1615556251.3868415], "version": 0.2, "tvm_version": "0.8.dev0"}
{"input": ["cuda -keys=cuda,gpu -max_num_threads=1024 -model=tx2 -thread_warp_size=32", "depthwise_conv2d_nchw.cuda", [["TENSOR", [1, 256, 34, 34], "int8"], ["TENSOR", [256, 1, 3, 3], "int8"], [1, 1], [0, 0, 0, 0], [1, 1], "int32"], {}], "config": {"index": 2768415, "code_hash": null, "entity": [["tile_f", "sp", [-1, 1, 1, 2]], ["tile_y", "sp", [-1, 2, 8, 2]], ["tile_x", "sp", [-1, 2, 16, 1]], ["auto_unroll_max_step", "ot", 1500], ["unroll_explicit", "ot", 1]]}, "result": [[3.193065392388009e-05], 0, 17.341033220291138, 1615560337.6509829], "version": 0.2, "tvm_version": "0.8.dev0"}
{"input": ["cuda -keys=cuda,gpu -max_num_threads=1024 -model=tx2 -thread_warp_size=32", "conv2d_NCHWc_int8.cuda", [["TENSOR", [1, 256, 32, 32], "int8"], ["TENSOR", [512, 256, 1, 1], "int8"], [1, 1], [0, 0, 0, 0], [1, 1], "NCHW", "int32"], {}], "config": {"index": 193565416, "code_hash": null, "entity": [["tile_n", "sp", [-1, 1, 1, 1]], ["tile_f", "sp", [-1, 2, 4, 1]], ["tile_y", "sp", [-1, 1, 1, 2]], ["tile_x", "sp", [-1, 1, 32, 1]], ["fuse_yx", "ot", 0], ["tile_rc", "sp", [-1, 32]], ["tile_ry", "sp", [-1, 1]], ["tile_rx", "sp", [-1, 1]], ["reorder_inner", "re", [0, 1, 2]], ["AA_double_buffer", "ot", 0], ["WW_double_buffer", "ot", 1], ["auto_unroll_max_step", "ot", 512]]}, "result": [[0.0001047571649484536], 0, 31.627723693847656, 1615568635.3673012], "version": 0.2, "tvm_version": "0.8.dev0"}
{"input": ["cuda -keys=cuda,gpu -max_num_threads=1024 -model=tx2 -thread_warp_size=32", "conv2d_NCHWc_int8.cuda", [["TENSOR", [1, 512, 32, 32], "int8"], ["TENSOR", [256, 512, 1, 1], "int8"], [1, 1], [0, 0, 0, 0], [1, 1], "NCHW", "int32"], {}], "config": {"index": 69639838, "code_hash": null, "entity": [["tile_n", "sp", [-1, 1, 1, 1]], ["tile_f", "sp", [-1, 1, 4, 4]], ["tile_y", "sp", [-1, 1, 1, 2]], ["tile_x", "sp", [-1, 1, 32, 1]], ["fuse_yx", "ot", 0], ["tile_rc", "sp", [-1, 16]], ["tile_ry", "sp", [-1, 1]], ["tile_rx", "sp", [-1, 1]], ["reorder_inner", "re", [2, 0, 1]], ["AA_double_buffer", "ot", 0], ["WW_double_buffer", "ot", 1], ["auto_unroll_max_step", "ot", 0]]}, "result": [[0.00010533845904761905], 0, 11.78766679763794, 1615575980.1724176], "version": 0.2, "tvm_version": "0.8.dev0"}
{"input": ["cuda -keys=cuda,gpu -max_num_threads=1024 -model=tx2 -thread_warp_size=32", "conv2d_NCHWc_int8.cuda", [["TENSOR", [1, 256, 32, 32], "int8"], ["TENSOR", [128, 256, 1, 1], "int8"], [1, 1], [0, 0, 0, 0], [1, 1], "NCHW", "int32"], {}], "config": {"index": 153552310, "code_hash": null, "entity": [["tile_n", "sp", [-1, 1, 1, 1]], ["tile_f", "sp", [-1, 1, 4, 2]], ["tile_y", "sp", [-1, 1, 1, 2]], ["tile_x", "sp", [-1, 1, 32, 1]], ["fuse_yx", "ot", 0], ["tile_rc", "sp", [-1, 8]], ["tile_ry", "sp", [-1, 1]], ["tile_rx", "sp", [-1, 1]], ["reorder_inner", "re", [1, 0, 2]], ["AA_double_buffer", "ot", 0], ["WW_double_buffer", "ot", 1], ["auto_unroll_max_step", "ot", 1500]]}, "result": [[3.2563685306050446e-05], 0, 26.612250566482544, 1615579800.0484428], "version": 0.2, "tvm_version": "0.8.dev0"}
{"input": ["cuda -keys=cuda,gpu -max_num_threads=1024 -model=tx2 -thread_warp_size=32", "conv2d_NCHWc_int8.cuda", [["TENSOR", [1, 160, 64, 64], "int8"], ["TENSOR", [128, 160, 1, 1], "int8"], [1, 1], [0, 0, 0, 0], [1, 1], "NCHW", "int32"], {}], "config": {"index": 136441131, "code_hash": null, "entity": [["tile_n", "sp", [-1, 1, 1, 1]], ["tile_f", "sp", [-1, 1, 4, 4]], ["tile_y", "sp", [-1, 1, 1, 2]], ["tile_x", "sp", [-1, 1, 32, 1]], ["fuse_yx", "ot", 1], ["tile_rc", "sp", [-1, 8]], ["tile_ry", "sp", [-1, 1]], ["tile_rx", "sp", [-1, 1]], ["reorder_inner", "re", [1, 2, 0]], ["AA_double_buffer", "ot", 1], ["WW_double_buffer", "ot", 1], ["auto_unroll_max_step", "ot", 0]]}, "result": [[8.427303373872107e-05], 0, 15.781352758407593, 1615591717.7594492], "version": 0.2, "tvm_version": "0.8.dev0"}
{"input": ["cuda -keys=cuda,gpu -max_num_threads=1024 -model=tx2 -thread_warp_size=32", "conv2d_NCHWc_int8.cuda", [["TENSOR", [1, 256, 64, 64], "int8"], ["TENSOR", [128, 256, 1, 1], "int8"], [1, 1], [0, 0, 0, 0], [1, 1], "NCHW", "int32"], {}], "config": {"index": 92185899, "code_hash": null, "entity": [["tile_n", "sp", [-1, 1, 1, 1]], ["tile_f", "sp", [-1, 1, 4, 4]], ["tile_y", "sp", [-1, 1, 1, 2]], ["tile_x", "sp", [-1, 1, 32, 1]], ["fuse_yx", "ot", 1], ["tile_rc", "sp", [-1, 16]], ["tile_ry", "sp", [-1, 1]], ["tile_rx", "sp", [-1, 1]], ["reorder_inner", "re", [2, 0, 1]], ["AA_double_buffer", "ot", 0], ["WW_double_buffer", "ot", 1], ["auto_unroll_max_step", "ot", 0]]}, "result": [[0.0001129490050916497], 0, 32.82540965080261, 1615595404.8191144], "version": 0.2, "tvm_version": "0.8.dev0"}
{"input": ["cuda -keys=cuda,gpu -max_num_threads=1024 -model=tx2 -thread_warp_size=32", "depthwise_conv2d_nchw.cuda", [["TENSOR", [1, 128, 66, 66], "int8"], ["TENSOR", [128, 1, 3, 3], "int8"], [1, 1], [0, 0, 0, 0], [1, 1], "int32"], {}], "config": {"index": 3665160, "code_hash": null, "entity": [["tile_f", "sp", [-1, 1, 1, 1]], ["tile_y", "sp", [-1, 4, 1, 4]], ["tile_x", "sp", [-1, 1, 64, 1]], ["auto_unroll_max_step", "ot", 256], ["unroll_explicit", "ot", 1]]}, "result": [[5.9571491937765205e-05], 0, 26.09581184387207, 1615599631.6003447], "version": 0.2, "tvm_version": "0.8.dev0"}
{"input": ["cuda -keys=cuda,gpu -max_num_threads=1024 -model=tx2 -thread_warp_size=32", "conv2d_NCHWc_int8.cuda", [["TENSOR", [1, 128, 64, 64], "int8"], ["TENSOR", [256, 128, 1, 1], "int8"], [1, 1], [0, 0, 0, 0], [1, 1], "NCHW", "int32"], {}], "config": {"index": 48187847, "code_hash": null, "entity": [["tile_n", "sp", [-1, 1, 1, 1]], ["tile_f", "sp", [-1, 1, 4, 8]], ["tile_y", "sp", [-1, 1, 1, 2]], ["tile_x", "sp", [-1, 1, 32, 1]], ["fuse_yx", "ot", 1], ["tile_rc", "sp", [-1, 16]], ["tile_ry", "sp", [-1, 1]], ["tile_rx", "sp", [-1, 1]], ["reorder_inner", "re", [0, 1, 2]], ["AA_double_buffer", "ot", 1], ["WW_double_buffer", "ot", 0], ["auto_unroll_max_step", "ot", 0]]}, "result": [[0.00012945556114285714], 0, 11.627429723739624, 1615604689.5074606], "version": 0.2, "tvm_version": "0.8.dev0"}
{"input": ["cuda -keys=cuda,gpu -max_num_threads=1024 -model=tx2 -thread_warp_size=32", "conv2d_NCHWc_int8.cuda", [["TENSOR", [1, 256, 64, 64], "int8"], ["TENSOR", [76, 256, 1, 1], "int8"], [1, 1], [0, 0, 0, 0], [1, 1], "NCHW", "int32"], {}], "config": {"index": 20074666, "code_hash": null, "entity": [["tile_n", "sp", [-1, 1, 1, 1]], ["tile_f", "sp", [-1, 1, 19, 1]], ["tile_y", "sp", [-1, 4, 1, 1]], ["tile_x", "sp", [-1, 1, 16, 1]], ["fuse_yx", "ot", 1], ["tile_rc", "sp", [-1, 32]], ["tile_ry", "sp", [-1, 1]], ["tile_rx", "sp", [-1, 1]], ["reorder_inner", "re", [1, 0, 2]], ["AA_double_buffer", "ot", 0], ["WW_double_buffer", "ot", 0], ["auto_unroll_max_step", "ot", 1500]]}, "result": [[7.609156229081443e-05], 0, 19.140217304229736, 1615612532.2571542], "version": 0.2, "tvm_version": "0.8.dev0"}
