results/tvm_log/myolo.log
{"input": ["cuda -keys=cuda,gpu -max_num_threads=1024 -model=unknown -thread_warp_size=32", "conv2d_NCHWc_int8.cuda", [["TENSOR", [1, 256, 32, 32], "int8"], ["TENSOR", [128, 256, 1, 1], "int8"], [1, 1], [0, 0, 0, 0], [1, 1], "NCHW", "int32"], {}], "config": {"index": 168288636, "code_hash": null, "entity": [["tile_n", "sp", [-1, 1, 1, 1]], ["tile_f", "sp", [-1, 2, 4, 1]], ["tile_y", "sp", [-1, 1, 2, 2]], ["tile_x", "sp", [-1, 1, 8, 1]], ["fuse_yx", "ot", 0], ["tile_rc", "sp", [-1, 8]], ["tile_ry", "sp", [-1, 1]], ["tile_rx", "sp", [-1, 1]], ["reorder_inner", "re", [1, 0, 2]], ["AA_double_buffer", "ot", 1], ["WW_double_buffer", "ot", 1], ["auto_unroll_max_step", "ot", 1500]]}, "result": [[6.892899401634116e-06], 0, 3.7019894123077393, 1612435811.7914834], "version": 0.2, "tvm_version": "0.8.dev0"}
{"input": ["cuda -keys=cuda,gpu -max_num_threads=1024 -model=unknown -thread_warp_size=32", "conv2d_NCHWc_int8.cuda", [["TENSOR", [1, 160, 64, 64], "int8"], ["TENSOR", [128, 160, 1, 1], "int8"], [1, 1], [0, 0, 0, 0], [1, 1], "NCHW", "int32"], {}], "config": {"index": 418910833, "code_hash": null, "entity": [["tile_n", "sp", [-1, 1, 1, 1]], ["tile_f", "sp", [-1, 1, 8, 2]], ["tile_y", "sp", [-1, 2, 4, 1]], ["tile_x", "sp", [-1, 2, 4, 1]], ["fuse_yx", "ot", 0], ["tile_rc", "sp", [-1, 4]], ["tile_ry", "sp", [-1, 1]], ["tile_rx", "sp", [-1, 1]], ["reorder_inner", "re", [0, 1, 2]], ["AA_double_buffer", "ot", 1], ["WW_double_buffer", "ot", 1], ["auto_unroll_max_step", "ot", 1500]]}, "result": [[1.5553553168920712e-05], 0, 4.402630090713501, 1612438752.1867597], "version": 0.2, "tvm_version": "0.8.dev0"}
{"input": ["cuda -keys=cuda,gpu -max_num_threads=1024 -model=unknown -thread_warp_size=32", "conv2d_NCHWc_int8.cuda", [["TENSOR", [1, 256, 64, 64], "int8"], ["TENSOR", [128, 256, 1, 1], "int8"], [1, 1], [0, 0, 0, 0], [1, 1], "NCHW", "int32"], {}], "config": {"index": 324078193, "code_hash": null, "entity": [["tile_n", "sp", [-1, 1, 1, 1]], ["tile_f", "sp", [-1, 1, 8, 2]], ["tile_y", "sp", [-1, 2, 4, 1]], ["tile_x", "sp", [-1, 2, 4, 1]], ["fuse_yx", "ot", 0], ["tile_rc", "sp", [-1, 16]], ["tile_ry", "sp", [-1, 1]], ["tile_rx", "sp", [-1, 1]], ["reorder_inner", "re", [2, 0, 1]], ["AA_double_buffer", "ot", 1], ["WW_double_buffer", "ot", 0], ["auto_unroll_max_step", "ot", 1500]]}, "result": [[1.90316623439001e-05], 0, 3.3925118446350098, 1612443212.0176923], "version": 0.2, "tvm_version": "0.8.dev0"}
{"input": ["cuda -keys=cuda,gpu -max_num_threads=1024 -model=unknown -thread_warp_size=32", "depthwise_conv2d_nchw.cuda", [["TENSOR", [1, 128, 66, 66], "int8"], ["TENSOR", [128, 1, 3, 3], "int8"], [1, 1], [0, 0, 0, 0], [1, 1], "int32"], {}], "config": {"index": 272640, "code_hash": null, "entity": [["tile_f", "sp", [-1, 1, 1, 1]], ["tile_y", "sp", [-1, 16, 1, 1]], ["tile_x", "sp", [-1, 1, 64, 1]], ["auto_unroll_max_step", "ot", 0], ["unroll_explicit", "ot", 0]]}, "result": [[4.3895074985003e-06], 0, 2.2621920108795166, 1612447356.5353026], "version": 0.2, "tvm_version": "0.8.dev0"}
{"input": ["cuda -keys=cuda,gpu -max_num_threads=1024 -model=unknown -thread_warp_size=32", "conv2d_NCHWc_int8.cuda", [["TENSOR", [1, 128, 64, 64], "int8"], ["TENSOR", [256, 128, 1, 1], "int8"], [1, 1], [0, 0, 0, 0], [1, 1], "NCHW", "int32"], {}], "config": {"index": 318458461, "code_hash": null, "entity": [["tile_n", "sp", [-1, 1, 1, 1]], ["tile_f", "sp", [-1, 1, 4, 1]], ["tile_y", "sp", [-1, 1, 1, 1]], ["tile_x", "sp", [-1, 1, 32, 1]], ["fuse_yx", "ot", 1], ["tile_rc", "sp", [-1, 16]], ["tile_ry", "sp", [-1, 1]], ["tile_rx", "sp", [-1, 1]], ["reorder_inner", "re", [1, 0, 2]], ["AA_double_buffer", "ot", 1], ["WW_double_buffer", "ot", 1], ["auto_unroll_max_step", "ot", 512]]}, "result": [[2.7439068930041155e-05], 0, 2.459054946899414, 1612455729.0383759], "version": 0.2, "tvm_version": "0.8.dev0"}
{"input": ["cuda -keys=cuda,gpu -max_num_threads=1024 -model=unknown -thread_warp_size=32", "conv2d_NCHWc_int8.cuda", [["TENSOR", [1, 256, 64, 64], "int8"], ["TENSOR", [76, 256, 1, 1], "int8"], [1, 1], [0, 0, 0, 0], [1, 1], "NCHW", "int32"], {}], "config": {"index": 14881778, "code_hash": null, "entity": [["tile_n", "sp", [-1, 1, 1, 1]], ["tile_f", "sp", [-1, 1, 19, 1]], ["tile_y", "sp", [-1, 1, 1, 1]], ["tile_x", "sp", [-1, 2, 16, 1]], ["fuse_yx", "ot", 1], ["tile_rc", "sp", [-1, 16]], ["tile_ry", "sp", [-1, 1]], ["tile_rx", "sp", [-1, 1]], ["reorder_inner", "re", [0, 2, 1]], ["AA_double_buffer", "ot", 0], ["WW_double_buffer", "ot", 1], ["auto_unroll_max_step", "ot", 512]]}, "result": [[1.4268646362200899e-05], 0, 2.815065383911133, 1612459112.1021116], "version": 0.2, "tvm_version": "0.8.dev0"}
{"input": ["cuda -keys=cuda,gpu -max_num_threads=1024 -model=unknown -thread_warp_size=32", "conv2d_NCHWc_int8.cuda", [["TENSOR", [1, 512, 16, 16], "int8"], ["TENSOR", [256, 512, 1, 1], "int8"], [1, 1], [0, 0, 0, 0], [1, 1], "NCHW", "int32"], {}], "config": {"index": 111174433, "code_hash": null, "entity": [["tile_n", "sp", [-1, 1, 1, 1]], ["tile_f", "sp", [-1, 1, 4, 1]], ["tile_y", "sp", [-1, 1, 1, 2]], ["tile_x", "sp", [-1, 1, 16, 1]], ["fuse_yx", "ot", 0], ["tile_rc", "sp", [-1, 16]], ["tile_ry", "sp", [-1, 1]], ["tile_rx", "sp", [-1, 1]], ["reorder_inner", "re", [0, 2, 1]], ["AA_double_buffer", "ot", 1], ["WW_double_buffer", "ot", 1], ["auto_unroll_max_step", "ot", 1500]]}, "result": [[6.780242847381087e-06], 0, 3.6084368228912354, 1612463001.048956], "version": 0.2, "tvm_version": "0.8.dev0"}
{"input": ["cuda -keys=cuda,gpu -max_num_threads=1024 -model=unknown -thread_warp_size=32", "conv2d_NCHWc_int8.cuda", [["TENSOR", [1, 352, 32, 32], "int8"], ["TENSOR", [256, 352, 1, 1], "int8"], [1, 1], [0, 0, 0, 0], [1, 1], "NCHW", "int32"], {}], "config": {"index": 279829046, "code_hash": null, "entity": [["tile_n", "sp", [-1, 1, 1, 1]], ["tile_f", "sp", [-1, 2, 4, 1]], ["tile_y", "sp", [-1, 1, 2, 2]], ["tile_x", "sp", [-1, 1, 8, 1]], ["fuse_yx", "ot", 0], ["tile_rc", "sp", [-1, 8]], ["tile_ry", "sp", [-1, 1]], ["tile_rx", "sp", [-1, 1]], ["reorder_inner", "re", [0, 1, 2]], ["AA_double_buffer", "ot", 1], ["WW_double_buffer", "ot", 1], ["auto_unroll_max_step", "ot", 1500]]}, "result": [[1.3117252465706835e-05], 0, 5.208118915557861, 1612466639.2172306], "version": 0.2, "tvm_version": "0.8.dev0"}
{"input": ["cuda -keys=cuda,gpu -max_num_threads=1024 -model=unknown -thread_warp_size=32", "conv2d_NCHWc_int8.cuda", [["TENSOR", [1, 512, 32, 32], "int8"], ["TENSOR", [256, 512, 1, 1], "int8"], [1, 1], [0, 0, 0, 0], [1, 1], "NCHW", "int32"], {}], "config": {"index": 61199138, "code_hash": null, "entity": [["tile_n", "sp", [-1, 1, 1, 1]], ["tile_f", "sp", [-1, 2, 4, 1]], ["tile_y", "sp", [-1, 2, 1, 1]], ["tile_x", "sp", [-1, 1, 16, 1]], ["fuse_yx", "ot", 0], ["tile_rc", "sp", [-1, 16]], ["tile_ry", "sp", [-1, 1]], ["tile_rx", "sp", [-1, 1]], ["reorder_inner", "re", [1, 0, 2]], ["AA_double_buffer", "ot", 0], ["WW_double_buffer", "ot", 1], ["auto_unroll_max_step", "ot", 0]]}, "result": [[1.6368436784797834e-05], 0, 2.4033925533294678, 1612472146.6224658], "version": 0.2, "tvm_version": "0.8.dev0"}
{"input": ["cuda -keys=cuda,gpu -max_num_threads=1024 -model=unknown -thread_warp_size=32", "depthwise_conv2d_nchw.cuda", [["TENSOR", [1, 256, 34, 34], "int8"], ["TENSOR", [256, 1, 3, 3], "int8"], [1, 1], [0, 0, 0, 0], [1, 1], "int32"], {}], "config": {"index": 2779755, "code_hash": null, "entity": [["tile_f", "sp", [-1, 1, 1, 1]], ["tile_y", "sp", [-1, 2, 1, 8]], ["tile_x", "sp", [-1, 1, 32, 1]], ["auto_unroll_max_step", "ot", 1500], ["unroll_explicit", "ot", 1]]}, "result": [[2.756465632268331e-06], 0, 2.2725718021392822, 1612474781.6493485], "version": 0.2, "tvm_version": "0.8.dev0"}
{"input": ["cuda -keys=cuda,gpu -max_num_threads=1024 -model=unknown -thread_warp_size=32", "conv2d_NCHWc_int8.cuda", [["TENSOR", [1, 256, 32, 32], "int8"], ["TENSOR", [512, 256, 1, 1], "int8"], [1, 1], [0, 0, 0, 0], [1, 1], "NCHW", "int32"], {}], "config": {"index": 176221854, "code_hash": null, "entity": [["tile_n", "sp", [-1, 1, 1, 1]], ["tile_f", "sp", [-1, 1, 8, 2]], ["tile_y", "sp", [-1, 2, 2, 2]], ["tile_x", "sp", [-1, 1, 8, 1]], ["fuse_yx", "ot", 0], ["tile_rc", "sp", [-1, 8]], ["tile_ry", "sp", [-1, 1]], ["tile_rx", "sp", [-1, 1]], ["reorder_inner", "re", [1, 2, 0]], ["AA_double_buffer", "ot", 1], ["WW_double_buffer", "ot", 0], ["auto_unroll_max_step", "ot", 512]]}, "result": [[1.8017637860394536e-05], 0, 2.640225410461426, 1612476947.2141128], "version": 0.2, "tvm_version": "0.8.dev0"}
{"input": ["cuda -keys=cuda,gpu -max_num_threads=1024 -model=unknown -thread_warp_size=32", "conv2d_NCHWc_int8.cuda", [["TENSOR", [1, 512, 32, 32], "int8"], ["TENSOR", [76, 512, 1, 1], "int8"], [1, 1], [0, 0, 0, 0], [1, 1], "NCHW", "int32"], {}], "config": {"index": 10979466, "code_hash": null, "entity": [["tile_n", "sp", [-1, 1, 1, 1]], ["tile_f", "sp", [-1, 1, 19, 1]], ["tile_y", "sp", [-1, 1, 2, 2]], ["tile_x", "sp", [-1, 1, 8, 1]], ["fuse_yx", "ot", 1], ["tile_rc", "sp", [-1, 32]], ["tile_ry", "sp", [-1, 1]], ["tile_rx", "sp", [-1, 1]], ["reorder_inner", "re", [0, 1, 2]], ["AA_double_buffer", "ot", 1], ["WW_double_buffer", "ot", 0], ["auto_unroll_max_step", "ot", 1500]]}, "result": [[9.64743046770972e-06], 0, 3.4335641860961914, 1612481177.2279446], "version": 0.2, "tvm_version": "0.8.dev0"}
{"input": ["cuda -keys=cuda,gpu -max_num_threads=1024 -model=unknown -thread_warp_size=32", "conv2d_NCHWc_int8.cuda", [["TENSOR", [1, 4, 514, 514], "int8"], ["TENSOR", [32, 4, 3, 3], "int8"], [2, 2], [0, 0, 0, 0], [1, 1], "NCHW", "int32"], {}], "config": {"index": 88265309, "code_hash": null, "entity": [["tile_n", "sp", [-1, 1, 1, 1]], ["tile_f", "sp", [-1, 1, 8, 1]], ["tile_y", "sp", [-1, 2, 2, 1]], ["tile_x", "sp", [-1, 1, 4, 1]], ["fuse_yx", "ot", 0], ["tile_rc", "sp", [-1, 1]], ["tile_ry", "sp", [-1, 3]], ["tile_rx", "sp", [-1, 1]], ["reorder_inner", "re", [1, 0, 2]], ["AA_double_buffer", "ot", 1], ["WW_double_buffer", "ot", 1], ["auto_unroll_max_step", "ot", 0]]}, "result": [[4.346197334542158e-05], 0, 2.5017495155334473, 1612487417.294539], "version": 0.2, "tvm_version": "0.8.dev0"}
{"input": ["cuda -keys=cuda,gpu -max_num_threads=1024 -model=unknown -thread_warp_size=32", "depthwise_conv2d_nchw.cuda", [["TENSOR", [1, 32, 258, 258], "int8"], ["TENSOR", [32, 1, 3, 3], "int8"], [1, 1], [0, 0, 0, 0], [1, 1], "int32"], {}], "config": {"index": 7906640, "code_hash": null, "entity": [["tile_f", "sp", [-1, 1, 1, 1]], ["tile_y", "sp", [-1, 1, 2, 8]], ["tile_x", "sp", [-1, 1, 16, 1]], ["auto_unroll_max_step", "ot", 1500], ["unroll_explicit", "ot", 1]]}, "result": [[2.9460790091743118e-05], 0, 2.744670867919922, 1612492655.514687], "version": 0.2, "tvm_version": "0.8.dev0"}
{"input": ["cuda -keys=cuda,gpu -max_num_threads=1024 -model=unknown -thread_warp_size=32", "conv2d_NCHWc_int8.cuda", [["TENSOR", [1, 32, 256, 256], "int8"], ["TENSOR", [16, 32, 1, 1], "int8"], [1, 1], [0, 0, 0, 0], [1, 1], "NCHW", "int32"], {}], "config": {"index": 148689754, "code_hash": null, "entity": [["tile_n", "sp", [-1, 1, 1, 1]], ["tile_f", "sp", [-1, 2, 2, 1]], ["tile_y", "sp", [-1, 1, 1, 1]], ["tile_x", "sp", [-1, 2, 8, 1]], ["fuse_yx", "ot", 0], ["tile_rc", "sp", [-1, 2]], ["tile_ry", "sp", [-1, 1]], ["tile_rx", "sp", [-1, 1]], ["reorder_inner", "re", [1, 0, 2]], ["AA_double_buffer", "ot", 1], ["WW_double_buffer", "ot", 1], ["auto_unroll_max_step", "ot", 1500]]}, "result": [[2.3741610638718608e-05], 0, 2.5451221466064453, 1612500415.829153], "version": 0.2, "tvm_version": "0.8.dev0"}
{"input": ["cuda -keys=cuda,gpu -max_num_threads=1024 -model=unknown -thread_warp_size=32", "conv2d_NCHWc_int8.cuda", [["TENSOR", [1, 16, 256, 256], "int8"], ["TENSOR", [96, 16, 1, 1], "int8"], [1, 1], [0, 0, 0, 0], [1, 1], "NCHW", "int32"], {}], "config": {"index": 603639646, "code_hash": null, "entity": [["tile_n", "sp", [-1, 1, 1, 1]], ["tile_f", "sp", [-1, 2, 6, 2]], ["tile_y", "sp", [-1, 1, 1, 2]], ["tile_x", "sp", [-1, 2, 8, 1]], ["fuse_yx", "ot", 1], ["tile_rc", "sp", [-1, 1]], ["tile_ry", "sp", [-1, 1]], ["tile_rx", "sp", [-1, 1]], ["reorder_inner", "re", [2, 0, 1]], ["AA_double_buffer", "ot", 1], ["WW_double_buffer", "ot", 1], ["auto_unroll_max_step", "ot", 512]]}, "result": [[0.00011819501423662248], 0, 3.8469340801239014, 1612509013.9677207], "version": 0.2, "tvm_version": "0.8.dev0"}
{"input": ["cuda -keys=cuda,gpu -max_num_threads=1024 -model=unknown -thread_warp_size=32", "depthwise_conv2d_nchw.cuda", [["TENSOR", [1, 96, 258, 258], "int8"], ["TENSOR", [96, 1, 3, 3], "int8"], [2, 2], [0, 0, 0, 0], [1, 1], "int32"], {}], "config": {"index": 17777312, "code_hash": null, "entity": [["tile_f", "sp", [-1, 1, 1, 1]], ["tile_y", "sp", [-1, 1, 2, 2]], ["tile_x", "sp", [-1, 1, 32, 2]], ["auto_unroll_max_step", "ot", 1500], ["unroll_explicit", "ot", 1]]}, "result": [[3.800695032742374e-05], 0, 2.8262829780578613, 1612512686.1793325], "version": 0.2, "tvm_version": "0.8.dev0"}
{"input": ["cuda -keys=cuda,gpu -max_num_threads=1024 -model=unknown -thread_warp_size=32", "conv2d_NCHWc_int8.cuda", [["TENSOR", [1, 96, 128, 128], "int8"], ["TENSOR", [24, 96, 1, 1], "int8"], [1, 1], [0, 0, 0, 0], [1, 1], "NCHW", "int32"], {}], "config": {"index": 224219768, "code_hash": null, "entity": [["tile_n", "sp", [-1, 1, 1, 1]], ["tile_f", "sp", [-1, 1, 6, 1]], ["tile_y", "sp", [-1, 1, 4, 1]], ["tile_x", "sp", [-1, 1, 8, 1]], ["fuse_yx", "ot", 1], ["tile_rc", "sp", [-1, 12]], ["tile_ry", "sp", [-1, 1]], ["tile_rx", "sp", [-1, 1]], ["reorder_inner", "re", [0, 1, 2]], ["AA_double_buffer", "ot", 0], ["WW_double_buffer", "ot", 1], ["auto_unroll_max_step", "ot", 1500]]}, "result": [[1.2016657822506861e-05], 0, 2.634460687637329, 1612519880.4649255], "version": 0.2, "tvm_version": "0.8.dev0"}
{"input": ["cuda -keys=cuda,gpu -max_num_threads=1024 -model=unknown -thread_warp_size=32", "depthwise_conv2d_nchw.cuda", [["TENSOR", [1, 144, 130, 130], "int8"], ["TENSOR", [144, 1, 3, 3], "int8"], [1, 1], [0, 0, 0, 0], [1, 1], "int32"], {}], "config": {"index": 26316850, "code_hash": null, "entity": [["tile_f", "sp", [-1, 1, 1, 1]], ["tile_y", "sp", [-1, 2, 2, 4]], ["tile_x", "sp", [-1, 1, 16, 1]], ["auto_unroll_max_step", "ot", 1500], ["unroll_explicit", "ot", 1]]}, "result": [[3.2846854517178e-05], 0, 2.8161983489990234, 1612522967.111686], "version": 0.2, "tvm_version": "0.8.dev0"}
{"input": ["cuda -keys=cuda,gpu -max_num_threads=1024 -model=unknown -thread_warp_size=32", "conv2d_NCHWc_int8.cuda", [["TENSOR", [1, 144, 128, 128], "int8"], ["TENSOR", [24, 144, 1, 1], "int8"], [1, 1], [0, 0, 0, 0], [1, 1], "NCHW", "int32"], {}], "config": {"index": 185299208, "code_hash": null, "entity": [["tile_n", "sp", [-1, 1, 1, 1]], ["tile_f", "sp", [-1, 1, 6, 1]], ["tile_y", "sp", [-1, 1, 1, 1]], ["tile_x", "sp", [-1, 1, 32, 1]], ["fuse_yx", "ot", 0], ["tile_rc", "sp", [-1, 12]], ["tile_ry", "sp", [-1, 1]], ["tile_rx", "sp", [-1, 1]], ["reorder_inner", "re", [1, 0, 2]], ["AA_double_buffer", "ot", 1], ["WW_double_buffer", "ot", 1], ["auto_unroll_max_step", "ot", 512]]}, "result": [[1.5245883240970763e-05], 0, 2.5255885124206543, 1612527275.4616148], "version": 0.2, "tvm_version": "0.8.dev0"}
{"input": ["cuda -keys=cuda,gpu -max_num_threads=1024 -model=unknown -thread_warp_size=32", "conv2d_NCHWc_int8.cuda", [["TENSOR", [1, 24, 128, 128], "int8"], ["TENSOR", [144, 24, 1, 1], "int8"], [1, 1], [0, 0, 0, 0], [1, 1], "NCHW", "int32"], {}], "config": {"index": 410595060, "code_hash": null, "entity": [["tile_n", "sp", [-1, 1, 1, 1]], ["tile_f", "sp", [-1, 1, 2, 3]], ["tile_y", "sp", [-1, 1, 32, 1]], ["tile_x", "sp", [-1, 2, 4, 1]], ["fuse_yx", "ot", 1], ["tile_rc", "sp", [-1, 3]], ["tile_ry", "sp", [-1, 1]], ["tile_rx", "sp", [-1, 1]], ["reorder_inner", "re", [2, 1, 0]], ["AA_double_buffer", "ot", 1], ["WW_double_buffer", "ot", 0], ["auto_unroll_max_step", "ot", 512]]}, "result": [[4.8647092431886984e-05], 0, 3.1749658584594727, 1612533327.5644019], "version": 0.2, "tvm_version": "0.8.dev0"}
{"input": ["cuda -keys=cuda,gpu -max_num_threads=1024 -model=unknown -thread_warp_size=32", "depthwise_conv2d_nchw.cuda", [["TENSOR", [1, 144, 130, 130], "int8"], ["TENSOR", [144, 1, 3, 3], "int8"], [2, 2], [0, 0, 0, 0], [1, 1], "int32"], {}], "config": {"index": 12997950, "code_hash": null, "entity": [["tile_f", "sp", [-1, 1, 1, 1]], ["tile_y", "sp", [-1, 4, 2, 1]], ["tile_x", "sp", [-1, 1, 16, 1]], ["auto_unroll_max_step", "ot", 1500], ["unroll_explicit", "ot", 1]]}, "result": [[1.571328753364406e-05], 0, 2.5052549839019775, 1612536796.1887002], "version": 0.2, "tvm_version": "0.8.dev0"}
{"input": ["cuda -keys=cuda,gpu -max_num_threads=1024 -model=unknown -thread_warp_size=32", "conv2d_NCHWc_int8.cuda", [["TENSOR", [1, 144, 64, 64], "int8"], ["TENSOR", [32, 144, 1, 1], "int8"], [1, 1], [0, 0, 0, 0], [1, 1], "NCHW", "int32"], {}], "config": {"index": 90629565, "code_hash": null, "entity": [["tile_n", "sp", [-1, 1, 1, 1]], ["tile_f", "sp", [-1, 2, 2, 1]], ["tile_y", "sp", [-1, 2, 4, 1]], ["tile_x", "sp", [-1, 1, 8, 1]], ["fuse_yx", "ot", 0], ["tile_rc", "sp", [-1, 12]], ["tile_ry", "sp", [-1, 1]], ["tile_rx", "sp", [-1, 1]], ["reorder_inner", "re", [2, 1, 0]], ["AA_double_buffer", "ot", 1], ["WW_double_buffer", "ot", 0], ["auto_unroll_max_step", "ot", 512]]}, "result": [[5.90371828514561e-06], 0, 2.6097331047058105, 1612540666.9575872], "version": 0.2, "tvm_version": "0.8.dev0"}
{"input": ["cuda -keys=cuda,gpu -max_num_threads=1024 -model=unknown -thread_warp_size=32", "depthwise_conv2d_nchw.cuda", [["TENSOR", [1, 192, 66, 66], "int8"], ["TENSOR", [192, 1, 3, 3], "int8"], [1, 1], [0, 0, 0, 0], [1, 1], "int32"], {}], "config": {"index": 12538176, "code_hash": null, "entity": [["tile_f", "sp", [-1, 1, 1, 1]], ["tile_y", "sp", [-1, 4, 8, 1]], ["tile_x", "sp", [-1, 4, 16, 1]], ["auto_unroll_max_step", "ot", 1500], ["unroll_explicit", "ot", 1]]}, "result": [[1.0929291639602858e-05], 0, 2.630617618560791, 1612544468.2731001], "version": 0.2, "tvm_version": "0.8.dev0"}
{"input": ["cuda -keys=cuda,gpu -max_num_threads=1024 -model=unknown -thread_warp_size=32", "conv2d_NCHWc_int8.cuda", [["TENSOR", [1, 192, 64, 64], "int8"], ["TENSOR", [32, 192, 1, 1], "int8"], [1, 1], [0, 0, 0, 0], [1, 1], "NCHW", "int32"], {}], "config": {"index": 86396369, "code_hash": null, "entity": [["tile_n", "sp", [-1, 1, 1, 1]], ["tile_f", "sp", [-1, 1, 8, 1]], ["tile_y", "sp", [-1, 1, 2, 2]], ["tile_x", "sp", [-1, 1, 8, 1]], ["fuse_yx", "ot", 0], ["tile_rc", "sp", [-1, 12]], ["tile_ry", "sp", [-1, 1]], ["tile_rx", "sp", [-1, 1]], ["reorder_inner", "re", [0, 1, 2]], ["AA_double_buffer", "ot", 1], ["WW_double_buffer", "ot", 0], ["auto_unroll_max_step", "ot", 512]]}, "result": [[6.289151421719768e-06], 0, 2.381455183029175, 1612548289.9623978], "version": 0.2, "tvm_version": "0.8.dev0"}
{"input": ["cuda -keys=cuda,gpu -max_num_threads=1024 -model=unknown -thread_warp_size=32", "conv2d_NCHWc_int8.cuda", [["TENSOR", [1, 32, 64, 64], "int8"], ["TENSOR", [192, 32, 1, 1], "int8"], [1, 1], [0, 0, 0, 0], [1, 1], "NCHW", "int32"], {}], "config": {"index": 385563596, "code_hash": null, "entity": [["tile_n", "sp", [-1, 1, 1, 1]], ["tile_f", "sp", [-1, 1, 2, 4]], ["tile_y", "sp", [-1, 2, 1, 1]], ["tile_x", "sp", [-1, 2, 32, 1]], ["fuse_yx", "ot", 0], ["tile_rc", "sp", [-1, 8]], ["tile_ry", "sp", [-1, 1]], ["tile_rx", "sp", [-1, 1]], ["reorder_inner", "re", [0, 1, 2]], ["AA_double_buffer", "ot", 0], ["WW_double_buffer", "ot", 0], ["auto_unroll_max_step", "ot", 1500]]}, "result": [[1.7859103844386584e-05], 0, 2.6656317710876465, 1612557590.7543266], "version": 0.2, "tvm_version": "0.8.dev0"}
{"input": ["cuda -keys=cuda,gpu -max_num_threads=1024 -model=unknown -thread_warp_size=32", "depthwise_conv2d_nchw.cuda", [["TENSOR", [1, 192, 66, 66], "int8"], ["TENSOR", [192, 1, 3, 3], "int8"], [2, 2], [0, 0, 0, 0], [1, 1], "int32"], {}], "config": {"index": 5656896, "code_hash": null, "entity": [["tile_f", "sp", [-1, 1, 1, 1]], ["tile_y", "sp", [-1, 1, 1, 4]], ["tile_x", "sp", [-1, 1, 32, 1]], ["auto_unroll_max_step", "ot", 1500], ["unroll_explicit", "ot", 1]]}, "result": [[4.839829606191474e-06], 0, 2.26072096824646, 1612559559.0954533], "version": 0.2, "tvm_version": "0.8.dev0"}
{"input": ["cuda -keys=cuda,gpu -max_num_threads=1024 -model=unknown -thread_warp_size=32", "conv2d_NCHWc_int8.cuda", [["TENSOR", [1, 192, 32, 32], "int8"], ["TENSOR", [64, 192, 1, 1], "int8"], [1, 1], [0, 0, 0, 0], [1, 1], "NCHW", "int32"], {}], "config": {"index": 120332252, "code_hash": null, "entity": [["tile_n", "sp", [-1, 1, 1, 1]], ["tile_f", "sp", [-1, 1, 8, 1]], ["tile_y", "sp", [-1, 1, 1, 1]], ["tile_x", "sp", [-1, 1, 16, 1]], ["fuse_yx", "ot", 0], ["tile_rc", "sp", [-1, 24]], ["tile_ry", "sp", [-1, 1]], ["tile_rx", "sp", [-1, 1]], ["reorder_inner", "re", [0, 1, 2]], ["AA_double_buffer", "ot", 1], ["WW_double_buffer", "ot", 0], ["auto_unroll_max_step", "ot", 1500]]}, "result": [[3.929032763453435e-06], 0, 2.1929564476013184, 1612562945.4881318], "version": 0.2, "tvm_version": "0.8.dev0"}
{"input": ["cuda -keys=cuda,gpu -max_num_threads=1024 -model=unknown -thread_warp_size=32", "conv2d_NCHWc_int8.cuda", [["TENSOR", [1, 384, 32, 32], "int8"], ["TENSOR", [64, 384, 1, 1], "int8"], [1, 1], [0, 0, 0, 0], [1, 1], "NCHW", "int32"], {}], "config": {"index": 107045794, "code_hash": null, "entity": [["tile_n", "sp", [-1, 1, 1, 1]], ["tile_f", "sp", [-1, 1, 4, 1]], ["tile_y", "sp", [-1, 1, 4, 1]], ["tile_x", "sp", [-1, 1, 8, 1]], ["fuse_yx", "ot", 1], ["tile_rc", "sp", [-1, 16]], ["tile_ry", "sp", [-1, 1]], ["tile_rx", "sp", [-1, 1]], ["reorder_inner", "re", [2, 0, 1]], ["AA_double_buffer", "ot", 0], ["WW_double_buffer", "ot", 1], ["auto_unroll_max_step", "ot", 512]]}, "result": [[5.940845406033708e-06], 0, 2.7797560691833496, 1612568465.4343934], "version": 0.2, "tvm_version": "0.8.dev0"}
{"input": ["cuda -keys=cuda,gpu -max_num_threads=1024 -model=unknown -thread_warp_size=32", "conv2d_NCHWc_int8.cuda", [["TENSOR", [1, 64, 32, 32], "int8"], ["TENSOR", [384, 64, 1, 1], "int8"], [1, 1], [0, 0, 0, 0], [1, 1], "NCHW", "int32"], {}], "config": {"index": 182091219, "code_hash": null, "entity": [["tile_n", "sp", [-1, 1, 1, 1]], ["tile_f", "sp", [-1, 1, 16, 1]], ["tile_y", "sp", [-1, 1, 4, 1]], ["tile_x", "sp", [-1, 2, 4, 1]], ["fuse_yx", "ot", 1], ["tile_rc", "sp", [-1, 16]], ["tile_ry", "sp", [-1, 1]], ["tile_rx", "sp", [-1, 1]], ["reorder_inner", "re", [0, 2, 1]], ["AA_double_buffer", "ot", 0], ["WW_double_buffer", "ot", 0], ["auto_unroll_max_step", "ot", 512]]}, "result": [[1.002250040865488e-05], 0, 2.476435422897339, 1612572983.2091625], "version": 0.2, "tvm_version": "0.8.dev0"}
{"input": ["cuda -keys=cuda,gpu -max_num_threads=1024 -model=unknown -thread_warp_size=32", "depthwise_conv2d_nchw.cuda", [["TENSOR", [1, 384, 34, 34], "int8"], ["TENSOR", [384, 1, 3, 3], "int8"], [1, 1], [0, 0, 0, 0], [1, 1], "int32"], {}], "config": {"index": 6576960, "code_hash": null, "entity": [["tile_f", "sp", [-1, 1, 1, 1]], ["tile_y", "sp", [-1, 4, 1, 4]], ["tile_x", "sp", [-1, 1, 32, 1]], ["auto_unroll_max_step", "ot", 256], ["unroll_explicit", "ot", 1]]}, "result": [[3.410341628545288e-06], 0, 2.548685073852539, 1612575723.624168], "version": 0.2, "tvm_version": "0.8.dev0"}
{"input": ["cuda -keys=cuda,gpu -max_num_threads=1024 -model=unknown -thread_warp_size=32", "conv2d_NCHWc_int8.cuda", [["TENSOR", [1, 384, 32, 32], "int8"], ["TENSOR", [96, 384, 1, 1], "int8"], [1, 1], [0, 0, 0, 0], [1, 1], "NCHW", "int32"], {}], "config": {"index": 400472258, "code_hash": null, "entity": [["tile_n", "sp", [-1, 1, 1, 1]], ["tile_f", "sp", [-1, 1, 4, 1]], ["tile_y", "sp", [-1, 2, 2, 1]], ["tile_x", "sp", [-1, 1, 8, 1]], ["fuse_yx", "ot", 0], ["tile_rc", "sp", [-1, 12]], ["tile_ry", "sp", [-1, 1]], ["tile_rx", "sp", [-1, 1]], ["reorder_inner", "re", [0, 1, 2]], ["AA_double_buffer", "ot", 1], ["WW_double_buffer", "ot", 1], ["auto_unroll_max_step", "ot", 1500]]}, "result": [[7.185361526122102e-06], 0, 3.3862593173980713, 1612580223.340259], "version": 0.2, "tvm_version": "0.8.dev0"}
{"input": ["cuda -keys=cuda,gpu -max_num_threads=1024 -model=unknown -thread_warp_size=32", "depthwise_conv2d_nchw.cuda", [["TENSOR", [1, 576, 34, 34], "int8"], ["TENSOR", [576, 1, 3, 3], "int8"], [1, 1], [0, 0, 0, 0], [1, 1], "int32"], {}], "config": {"index": 14154021, "code_hash": null, "entity": [["tile_f", "sp", [-1, 1, 2, 1]], ["tile_y", "sp", [-1, 2, 2, 8]], ["tile_x", "sp", [-1, 1, 32, 1]], ["auto_unroll_max_step", "ot", 1500], ["unroll_explicit", "ot", 1]]}, "result": [[6.752734474644478e-06], 0, 2.3194382190704346, 1612582608.1995854], "version": 0.2, "tvm_version": "0.8.dev0"}
{"input": ["cuda -keys=cuda,gpu -max_num_threads=1024 -model=unknown -thread_warp_size=32", "conv2d_NCHWc_int8.cuda", [["TENSOR", [1, 576, 32, 32], "int8"], ["TENSOR", [96, 576, 1, 1], "int8"], [1, 1], [0, 0, 0, 0], [1, 1], "NCHW", "int32"], {}], "config": {"index": 521911145, "code_hash": null, "entity": [["tile_n", "sp", [-1, 1, 1, 1]], ["tile_f", "sp", [-1, 1, 8, 1]], ["tile_y", "sp", [-1, 2, 1, 1]], ["tile_x", "sp", [-1, 1, 16, 1]], ["fuse_yx", "ot", 0], ["tile_rc", "sp", [-1, 8]], ["tile_ry", "sp", [-1, 1]], ["tile_rx", "sp", [-1, 1]], ["reorder_inner", "re", [1, 2, 0]], ["AA_double_buffer", "ot", 1], ["WW_double_buffer", "ot", 1], ["auto_unroll_max_step", "ot", 1500]]}, "result": [[9.266471002183936e-06], 0, 3.8878278732299805, 1612587118.7135432], "version": 0.2, "tvm_version": "0.8.dev0"}
{"input": ["cuda -keys=cuda,gpu -max_num_threads=1024 -model=unknown -thread_warp_size=32", "conv2d_NCHWc_int8.cuda", [["TENSOR", [1, 96, 32, 32], "int8"], ["TENSOR", [576, 96, 1, 1], "int8"], [1, 1], [0, 0, 0, 0], [1, 1], "NCHW", "int32"], {}], "config": {"index": 1240660465, "code_hash": null, "entity": [["tile_n", "sp", [-1, 1, 1, 1]], ["tile_f", "sp", [-1, 1, 12, 1]], ["tile_y", "sp", [-1, 1, 1, 1]], ["tile_x", "sp", [-1, 2, 16, 1]], ["fuse_yx", "ot", 0], ["tile_rc", "sp", [-1, 8]], ["tile_ry", "sp", [-1, 1]], ["tile_rx", "sp", [-1, 1]], ["reorder_inner", "re", [2, 0, 1]], ["AA_double_buffer", "ot", 1], ["WW_double_buffer", "ot", 1], ["auto_unroll_max_step", "ot", 1500]]}, "result": [[1.541393985607711e-05], 0, 2.363194227218628, 1612591907.9294991], "version": 0.2, "tvm_version": "0.8.dev0"}
{"input": ["cuda -keys=cuda,gpu -max_num_threads=1024 -model=unknown -thread_warp_size=32", "depthwise_conv2d_nchw.cuda", [["TENSOR", [1, 576, 34, 34], "int8"], ["TENSOR", [576, 1, 3, 3], "int8"], [2, 2], [0, 0, 0, 0], [1, 1], "int32"], {}], "config": {"index": 4538520, "code_hash": null, "entity": [["tile_f", "sp", [-1, 1, 1, 1]], ["tile_y", "sp", [-1, 2, 8, 1]], ["tile_x", "sp", [-1, 1, 16, 1]], ["auto_unroll_max_step", "ot", 256], ["unroll_explicit", "ot", 1]]}, "result": [[4.672344743753934e-06], 0, 2.230372905731201, 1612594719.2210155], "version": 0.2, "tvm_version": "0.8.dev0"}
{"input": ["cuda -keys=cuda,gpu -max_num_threads=1024 -model=unknown -thread_warp_size=32", "conv2d_NCHWc_int8.cuda", [["TENSOR", [1, 576, 16, 16], "int8"], ["TENSOR", [160, 576, 1, 1], "int8"], [1, 1], [0, 0, 0, 0], [1, 1], "NCHW", "int32"], {}], "config": {"index": 204565614, "code_hash": null, "entity": [["tile_n", "sp", [-1, 1, 1, 1]], ["tile_f", "sp", [-1, 1, 4, 1]], ["tile_y", "sp", [-1, 1, 2, 1]], ["tile_x", "sp", [-1, 1, 16, 1]], ["fuse_yx", "ot", 1], ["tile_rc", "sp", [-1, 16]], ["tile_ry", "sp", [-1, 1]], ["tile_rx", "sp", [-1, 1]], ["reorder_inner", "re", [1, 2, 0]], ["AA_double_buffer", "ot", 1], ["WW_double_buffer", "ot", 1], ["auto_unroll_max_step", "ot", 1500]]}, "result": [[5.561325617399555e-06], 0, 2.8135883808135986, 1612597833.2501097], "version": 0.2, "tvm_version": "0.8.dev0"}
{"input": ["cuda -keys=cuda,gpu -max_num_threads=1024 -model=unknown -thread_warp_size=32", "conv2d_NCHWc_int8.cuda", [["TENSOR", [1, 960, 16, 16], "int8"], ["TENSOR", [160, 960, 1, 1], "int8"], [1, 1], [0, 0, 0, 0], [1, 1], "NCHW", "int32"], {}], "config": {"index": 272572334, "code_hash": null, "entity": [["tile_n", "sp", [-1, 1, 1, 1]], ["tile_f", "sp", [-1, 1, 4, 1]], ["tile_y", "sp", [-1, 1, 4, 1]], ["tile_x", "sp", [-1, 1, 8, 1]], ["fuse_yx", "ot", 1], ["tile_rc", "sp", [-1, 16]], ["tile_ry", "sp", [-1, 1]], ["tile_rx", "sp", [-1, 1]], ["reorder_inner", "re", [1, 2, 0]], ["AA_double_buffer", "ot", 1], ["WW_double_buffer", "ot", 1], ["auto_unroll_max_step", "ot", 1500]]}, "result": [[7.7955383083894e-06], 0, 4.220938682556152, 1612601301.0300431], "version": 0.2, "tvm_version": "0.8.dev0"}
{"input": ["cuda -keys=cuda,gpu -max_num_threads=1024 -model=unknown -thread_warp_size=32", "conv2d_NCHWc_int8.cuda", [["TENSOR", [1, 160, 16, 16], "int8"], ["TENSOR", [960, 160, 1, 1], "int8"], [1, 1], [0, 0, 0, 0], [1, 1], "NCHW", "int32"], {}], "config": {"index": 620382607, "code_hash": null, "entity": [["tile_n", "sp", [-1, 1, 1, 1]], ["tile_f", "sp", [-1, 2, 4, 1]], ["tile_y", "sp", [-1, 2, 2, 1]], ["tile_x", "sp", [-1, 1, 8, 1]], ["fuse_yx", "ot", 0], ["tile_rc", "sp", [-1, 8]], ["tile_ry", "sp", [-1, 1]], ["tile_rx", "sp", [-1, 1]], ["reorder_inner", "re", [1, 0, 2]], ["AA_double_buffer", "ot", 1], ["WW_double_buffer", "ot", 0], ["auto_unroll_max_step", "ot", 1500]]}, "result": [[8.756870973868125e-06], 0, 2.641148567199707, 1612606836.8405962], "version": 0.2, "tvm_version": "0.8.dev0"}
{"input": ["cuda -keys=cuda,gpu -max_num_threads=1024 -model=unknown -thread_warp_size=32", "depthwise_conv2d_nchw.cuda", [["TENSOR", [1, 960, 18, 18], "int8"], ["TENSOR", [960, 1, 3, 3], "int8"], [1, 1], [0, 0, 0, 0], [1, 1], "int32"], {}], "config": {"index": 7280476, "code_hash": null, "entity": [["tile_f", "sp", [-1, 1, 2, 1]], ["tile_y", "sp", [-1, 4, 1, 4]], ["tile_x", "sp", [-1, 1, 16, 1]], ["auto_unroll_max_step", "ot", 256], ["unroll_explicit", "ot", 1]]}, "result": [[2.748043294898829e-06], 0, 2.2401585578918457, 1612609470.809785], "version": 0.2, "tvm_version": "0.8.dev0"}
{"input": ["cuda -keys=cuda,gpu -max_num_threads=1024 -model=unknown -thread_warp_size=32", "conv2d_NCHWc_int8.cuda", [["TENSOR", [1, 960, 16, 16], "int8"], ["TENSOR", [320, 960, 1, 1], "int8"], [1, 1], [0, 0, 0, 0], [1, 1], "NCHW", "int32"], {}], "config": {"index": 428800289, "code_hash": null, "entity": [["tile_n", "sp", [-1, 1, 1, 1]], ["tile_f", "sp", [-1, 1, 8, 1]], ["tile_y", "sp", [-1, 1, 4, 1]], ["tile_x", "sp", [-1, 2, 4, 1]], ["fuse_yx", "ot", 0], ["tile_rc", "sp", [-1, 16]], ["tile_ry", "sp", [-1, 1]], ["tile_rx", "sp", [-1, 1]], ["reorder_inner", "re", [1, 0, 2]], ["AA_double_buffer", "ot", 0], ["WW_double_buffer", "ot", 1], ["auto_unroll_max_step", "ot", 1500]]}, "result": [[1.1935041891267519e-05], 0, 2.3301022052764893, 1612614865.7059343], "version": 0.2, "tvm_version": "0.8.dev0"}
{"input": ["cuda -keys=cuda,gpu -max_num_threads=1024 -model=unknown -thread_warp_size=32", "conv2d_NCHWc_int8.cuda", [["TENSOR", [1, 320, 16, 16], "int8"], ["TENSOR", [1280, 320, 1, 1], "int8"], [1, 1], [0, 0, 0, 0], [1, 1], "NCHW", "int32"], {}], "config": {"index": 160645004, "code_hash": null, "entity": [["tile_n", "sp", [-1, 1, 1, 1]], ["tile_f", "sp", [-1, 2, 8, 1]], ["tile_y", "sp", [-1, 2, 4, 1]], ["tile_x", "sp", [-1, 2, 4, 1]], ["fuse_yx", "ot", 0], ["tile_rc", "sp", [-1, 10]], ["tile_ry", "sp", [-1, 1]], ["tile_rx", "sp", [-1, 1]], ["reorder_inner", "re", [0, 2, 1]], ["AA_double_buffer", "ot", 1], ["WW_double_buffer", "ot", 1], ["auto_unroll_max_step", "ot", 0]]}, "result": [[1.3135190040707075e-05], 0, 2.332707643508911, 1612621135.5234778], "version": 0.2, "tvm_version": "0.8.dev0"}
{"input": ["cuda -keys=cuda,gpu -max_num_threads=1024 -model=unknown -thread_warp_size=32", "conv2d_NCHWc_int8.cuda", [["TENSOR", [1, 1280, 16, 16], "int8"], ["TENSOR", [512, 1280, 1, 1], "int8"], [1, 1], [0, 0, 0, 0], [1, 1], "NCHW", "int32"], {}], "config": {"index": 286261701, "code_hash": null, "entity": [["tile_n", "sp", [-1, 1, 1, 1]], ["tile_f", "sp", [-1, 1, 8, 1]], ["tile_y", "sp", [-1, 1, 2, 2]], ["tile_x", "sp", [-1, 1, 8, 1]], ["fuse_yx", "ot", 1], ["tile_rc", "sp", [-1, 20]], ["tile_ry", "sp", [-1, 1]], ["tile_rx", "sp", [-1, 1]], ["reorder_inner", "re", [1, 2, 0]], ["AA_double_buffer", "ot", 1], ["WW_double_buffer", "ot", 1], ["auto_unroll_max_step", "ot", 1500]]}, "result": [[1.9427149473168342e-05], 0, 2.2945332527160645, 1612625541.824717], "version": 0.2, "tvm_version": "0.8.dev0"}
{"input": ["cuda -keys=cuda,gpu -max_num_threads=1024 -model=unknown -thread_warp_size=32", "conv2d_NCHWc_int8.cuda", [["TENSOR", [1, 1024, 16, 16], "int8"], ["TENSOR", [512, 1024, 1, 1], "int8"], [1, 1], [0, 0, 0, 0], [1, 1], "NCHW", "int32"], {}], "config": {"index": 32979616, "code_hash": null, "entity": [["tile_n", "sp", [-1, 1, 1, 1]], ["tile_f", "sp", [-1, 2, 4, 1]], ["tile_y", "sp", [-1, 2, 4, 1]], ["tile_x", "sp", [-1, 1, 8, 1]], ["fuse_yx", "ot", 0], ["tile_rc", "sp", [-1, 16]], ["tile_ry", "sp", [-1, 1]], ["tile_rx", "sp", [-1, 1]], ["reorder_inner", "re", [0, 1, 2]], ["AA_double_buffer", "ot", 0], ["WW_double_buffer", "ot", 1], ["auto_unroll_max_step", "ot", 0]]}, "result": [[1.6436357574055875e-05], 0, 2.1134519577026367, 1612631715.4917562], "version": 0.2, "tvm_version": "0.8.dev0"}
{"input": ["cuda -keys=cuda,gpu -max_num_threads=1024 -model=unknown -thread_warp_size=32", "depthwise_conv2d_nchw.cuda", [["TENSOR", [1, 512, 18, 18], "int8"], ["TENSOR", [512, 1, 3, 3], "int8"], [1, 1], [0, 0, 0, 0], [1, 1], "int32"], {}], "config": {"index": 1186699, "code_hash": null, "entity": [["tile_f", "sp", [-1, 1, 4, 1]], ["tile_y", "sp", [-1, 16, 1, 1]], ["tile_x", "sp", [-1, 1, 16, 1]], ["auto_unroll_max_step", "ot", 256], ["unroll_explicit", "ot", 1]]}, "result": [[2.1977773020462632e-06], 0, 2.2139666080474854, 1612634633.6116018], "version": 0.2, "tvm_version": "0.8.dev0"}
{"input": ["cuda -keys=cuda,gpu -max_num_threads=1024 -model=unknown -thread_warp_size=32", "conv2d_NCHWc_int8.cuda", [["TENSOR", [1, 512, 16, 16], "int8"], ["TENSOR", [1024, 512, 1, 1], "int8"], [1, 1], [0, 0, 0, 0], [1, 1], "NCHW", "int32"], {}], "config": {"index": 218567433, "code_hash": null, "entity": [["tile_n", "sp", [-1, 1, 1, 1]], ["tile_f", "sp", [-1, 2, 4, 1]], ["tile_y", "sp", [-1, 2, 2, 1]], ["tile_x", "sp", [-1, 1, 8, 1]], ["fuse_yx", "ot", 1], ["tile_rc", "sp", [-1, 16]], ["tile_ry", "sp", [-1, 1]], ["tile_rx", "sp", [-1, 1]], ["reorder_inner", "re", [0, 2, 1]], ["AA_double_buffer", "ot", 1], ["WW_double_buffer", "ot", 1], ["auto_unroll_max_step", "ot", 1500]]}, "result": [[1.5897153580380733e-05], 0, 2.552250623703003, 1612639512.4610536], "version": 0.2, "tvm_version": "0.8.dev0"}
{"input": ["cuda -keys=cuda,gpu -max_num_threads=1024 -model=unknown -thread_warp_size=32", "conv2d_NCHWc_int8.cuda", [["TENSOR", [1, 1024, 16, 16], "int8"], ["TENSOR", [76, 1024, 1, 1], "int8"], [1, 1], [0, 0, 0, 0], [1, 1], "NCHW", "int32"], {}], "config": {"index": 1633428, "code_hash": null, "entity": [["tile_n", "sp", [-1, 1, 1, 1]], ["tile_f", "sp", [-1, 1, 1, 1]], ["tile_y", "sp", [-1, 1, 8, 1]], ["tile_x", "sp", [-1, 1, 8, 1]], ["fuse_yx", "ot", 1], ["tile_rc", "sp", [-1, 16]], ["tile_ry", "sp", [-1, 1]], ["tile_rx", "sp", [-1, 1]], ["reorder_inner", "re", [0, 1, 2]], ["AA_double_buffer", "ot", 1], ["WW_double_buffer", "ot", 1], ["auto_unroll_max_step", "ot", 0]]}, "result": [[8.524739734143e-06], 0, 2.099895715713501, 1612644914.213925], "version": 0.2, "tvm_version": "0.8.dev0"}
